title,original_title,score,genres,release_year,length_in_minutes,synopsis,directors,actors,public,countries_of_origin,original_languages
"Three Billboards Outside Ebbing, Missouri",,8.1,"Comedy,Crime,Drama",2017,115,A mother personally challenges the local authorities to solve her daughter's murder when they fail to catch the culprit.,Martin McDonagh,"Frances McDormand,Woody Harrelson,Sam Rockwell,Caleb Landry Jones,Kerry Condon,Alejandro Barrios,Clarke Peters,Darrell Britt-Gibson,Abbie Cornish,Riya May Atwood,Selah Atwood,Lucas Hedges,Zeljko Ivanek,Amanda Warren,Malaya Rivera Drew,Sandy Martin,Peter Dinklage,Christopher Berry",R,"United Kingdom,United States",English
Trainspotting,,8.1,Drama,1996,93,"Renton, deeply immersed in the Edinburgh drug scene, tries to clean up and get out, despite the allure of the drugs and influence of friends.",Danny Boyle,"Ewan McGregor,Ewen Bremner,Jonny Lee Miller,Kevin McKidd,Robert Carlyle,Kelly Macdonald,Peter Mullan,James Cosmo,Eileen Nicholas,Susan Vidler,Pauline Lynch,Shirley Henderson,Stuart McQuarrie,Irvine Welsh,Dale Winton,Keith Allen,Kevin Allen,Annie Louise Ross",R,United Kingdom,English
Warrior,,8.2,"Action,Drama,Sport",2011,140,"The youngest son of an alcoholic former boxer returns home, where he's trained by his father for competition in a mixed martial arts tournament - a path that puts the fighter on a collision course with his estranged, older brother.",Gavin O'Connor,"Tom Hardy,Nick Nolte,Joel Edgerton,Jennifer Morrison,Frank Grillo,Kevin Dunn,Maximiliano Hernández,Bryan Callen,Sam Sheridan,Fernando Chien,Jake McLaughlin,Vanessa Martinez,Denzel Whitaker,Carlos Miranda,Nick Lehane,Laura Chinn,Capri Thomas,Lexi Cowan",PG-13,United States,"English,Spanish"
Dial M for Murder,,8.2,"Crime,Thriller",1954,105,A former tennis star arranges the murder of his adulterous wife.,Alfred Hitchcock,"Ray Milland,Grace Kelly,Robert Cummings,John Williams,Anthony Dawson,Leo Britt,Patrick Allen,George Leigh,George Alderson,Robin Hughes,Richard Bender,Robin Sanders Clark,Jack Cunningham,Robert Dobson,Guy Doleman,Bess Flowers,Robert Garvin,Herschel Graham",PG,United States,English
Howl's Moving Castle,Hauru no ugoku shiro,8.2,"Animation,Adventure,Family",2004,119,"When an unconfident young woman is cursed with an old body by a spiteful witch, her only chance of breaking the spell lies with a self-indulgent yet insecure young wizard and his companions in his legged, walking castle.",Hayao Miyazaki,"Chieko Baishô,Takuya Kimura,Tatsuya Gashûin,Akihiro Miwa,Ryûnosuke Kamiki,Mitsunori Isaki,Yô Ôizumi,Akio Ôtsuka,Daijirô Harada,Haruko Katô,Jean Simmons,Christian Bale,Lauren Bacall,Blythe Danner,Emily Mortimer,Josh Hutcherson,Billy Crystal,Jena Malone",PG,Japan,Japanese
The Bridge on the River Kwai,,8.2,"Adventure,Drama,War",1957,161,"British POWs are forced to build a railway bridge across the river Kwai for their Japanese captors in occupied Burma, not knowing that the allied forces are planning a daring commando raid through the jungle to destroy it.",David Lean,"William Holden,Alec Guinness,Jack Hawkins,Sessue Hayakawa,James Donald,Geoffrey Horne,André Morell,Peter Williams,John Boxer,Percy Herbert,Harold Goodwin,Ann Sears,Heihachirô Ôkawa,Keiichirô Katsumoto,M.R.B. Chakrabandhu,Vilaiwan Seeboonreaung,Ngamta Suphaphongs,Javanart Punynchoti",PG,"United Kingdom,United States","English,Japanese,Thai"
The Secret in Their Eyes,El secreto de sus ojos,8.2,"Drama,Mystery,Romance",2009,129,A retired legal counselor writes a novel hoping to find closure for one of his past unresolved homicide cases and for his unreciprocated love with his superior - both of which still haunt him decades later.,Juan José Campanella,"Ricardo Darín,Soledad Villamil,Pablo Rago,Carla Quevedo,Javier Godino,Bárbara Palladino,Rudy Romano,Alejandro Abelenda,Mario Alarcón,Guillermo Francella,Sebastián Blanco,Mariano Argento,José Luis Gioia,Juan José Ortíz,Kiko Cerone,Fernando Pardo,Maximiliano Trento,Sergio Santana",R,"Argentina,Spain",Spanish
V for Vendetta,,8.2,"Action,Drama,Sci-Fi",2005,132,"In a future British dystopian society, a shadowy freedom fighter, known only by the alias of ""V"", plots to overthrow the tyrannical government - with the help of a young woman.",James McTeigue,"Hugo Weaving,Natalie Portman,Rupert Graves,Stephen Rea,Stephen Fry,John Hurt,Tim Pigott-Smith,Roger Allam,Ben Miles,Sinéad Cusack,Natasha Wightman,John Standing,Eddie Marsan,Clive Ashborn,Emma Field-Rayner,Ian Burfield,Mark Phoenix,Alister Mazzotti",R,"United States,United Kingdom,Germany",English
Chinatown,,8.2,"Drama,Mystery,Thriller",1974,130,"A private detective hired to expose an adulterer in 1930s Los Angeles finds himself caught up in a web of deceit, corruption, and murder.",Roman Polanski,"Jack Nicholson,Faye Dunaway,John Huston,Perry Lopez,John Hillerman,Darrell Zwerling,Diane Ladd,Roy Jenson,Roman Polanski,Richard Bakalyan,Joe Mantell,Bruce Glover,Nandu Hinds,James O'Rear,James Hong,Beulah Quo,Jerry Fujikawa,Belinda Palmer",R,United States,"English,Cantonese,Spanish"
Inside Out,,8.2,"Animation,Adventure,Comedy",2015,95,"After young Riley is uprooted from her Midwest life and moved to San Francisco, her emotions - Joy, Fear, Anger, Disgust and Sadness - conflict on how best to navigate a new city, house, and school.","Pete Docter,Ronnie Del Carmen","Amy Poehler,Bill Hader,Lewis Black,Mindy Kaling,Phyllis Smith,Richard Kind,Kaitlyn Dias,Diane Lane,Kyle MacLachlan,Paula Poundstone,Bobby Moynihan,Paula Pell,Dave Goelz,Frank Oz,Josh Cooley,Flea,John Ratzenberger,Carlos Alazraqui",PG,United States,"English,Portuguese"
The Elephant Man,,8.2,"Biography,Drama",1980,124,"A Victorian surgeon rescues a heavily disfigured man who is mistreated while scraping a living as a side-show freak. Behind his monstrous façade, there is revealed a person of kindness, intelligence and sophistication.",David Lynch,"Anthony Hopkins,John Hurt,Anne Bancroft,John Gielgud,Wendy Hiller,Freddie Jones,Michael Elphick,Hannah Gordon,Helen Ryan,John Standing,Dexter Fletcher,Lesley Dunlop,Phoebe Nicholls,Pat Gorman,Claire Davenport,Orla Pederson,Patsy Smart,Frederick Treves",PG,"United States,United Kingdom","English,French"
The Thing,,8.2,"Horror,Mystery,Sci-Fi",1982,109,A research team in Antarctica is hunted by a shape-shifting alien that assumes the appearance of its victims.,John Carpenter,"Kurt Russell,Wilford Brimley,Keith David,Richard Masur,T.K. Carter,David Clennon,Richard Dysart,Charles Hallahan,Peter Maloney,Donald Moffat,Joel Polis,Thomas G. Waites,Norbert Weisser,Larry Franco,Nate Irwin,William Zeman,Adrienne Barbeau,John Carpenter",R,"United States,Canada","English,Norwegian"
"Lock, Stock and Two Smoking Barrels",,8.2,"Action,Comedy,Crime",1998,107,"Eddy persuades his three pals to pool money for a vital poker game against a powerful local mobster, Hatchet Harry. Eddy loses, after which Harry gives him a week to pay back 500,000 pounds.",Guy Ritchie,"Jason Flemyng,Dexter Fletcher,Nick Moran,Jason Statham,Steven Mackintosh,Nicholas Rowe,Nick Marcq,Charles Forbes,Vinnie Jones,Lenny McLean,Peter McNicholl,P.H. Moriarty,Frank Harper,Steve Sweeney,Huggy Leaver,Ronnie Fox,Tony McMahon,Stephen Marcus",R,United Kingdom,English
Gone with the Wind,,8.2,"Drama,Romance,War",1939,238,The manipulative daughter of a Georgia plantation owner conducts a turbulent romance with a roguish profiteer during the American Civil War and Reconstruction periods.,"Victor Fleming,George Cukor,Sam Wood","Clark Gable,Vivien Leigh,Thomas Mitchell,Barbara O'Neil,Evelyn Keyes,Ann Rutherford,George Reeves,Fred Crane,Hattie McDaniel,Oscar Polk,Butterfly McQueen,Victor Jory,Everett Brown,Howard Hickman,Alicia Rhett,Leslie Howard,Olivia de Havilland,Rand Brooks",Passed,United States,English
Raging Bull,,8.2,"Biography,Drama,Sport",1980,129,"The life of boxer Jake LaMotta, whose violence and temper that led him to the top in the ring destroyed his life outside of it.",Martin Scorsese,"Robert De Niro,Cathy Moriarty,Joe Pesci,Frank Vincent,Nicholas Colasanto,Theresa Saldana,Mario Gallo,Frank Adonis,Joseph Bono,Frank Topham,Lori Anne Flax,Charles Scorsese,Don Dunphy,Bill Hanrahan,Rita Bennett,James V. Christy,Bernie Allen,Floyd Anderson",R,United States,English
The Great Escape,,8.2,"Adventure,Drama,History",1963,172,Allied prisoners of war plan for several hundred of their number to escape from a German camp during World War II.,John Sturges,"Steve McQueen,James Garner,Richard Attenborough,Charles Bronson,James Donald,Donald Pleasence,James Coburn,Hannes Messemer,David McCallum,Gordon Jackson,John Leyton,Angus Lennie,Nigel Stock,Robert Graf,Jud Taylor,Hans Reiser,Harry Riebauer,William Russell",Approved,United States,"English,German,French,Russian,Spanish"
Rashomon,Rashômon,8.2,"Crime,Drama,Mystery",1950,88,"The rape of a bride and the murder of her samurai husband are recalled from the perspectives of a bandit, the bride, the samurai's ghost and a woodcutter.",Akira Kurosawa,"Toshirô Mifune,Machiko Kyô,Masayuki Mori,Takashi Shimura,Minoru Chiaki,Kichijirô Ueda,Noriko Honma,Daisuke Katô",Not Rated,Japan,Japanese
Finding Nemo,,8.2,"Animation,Adventure,Comedy",2003,100,"After his son is captured in the Great Barrier Reef and taken to Sydney, a timid clownfish sets out on a journey to bring him home.","Andrew Stanton,Lee Unkrich","Albert Brooks,Ellen DeGeneres,Alexander Gould,Willem Dafoe,Brad Garrett,Allison Janney,Austin Pendleton,Stephen Root,Vicki Lewis,Joe Ranft,Geoffrey Rush,Andrew Stanton,Elizabeth Perkins,Nicholas Bird,Bob Peterson,Barry Humphries,Eric Bana,Bruce Spence",G,United States,English
Kill Bill: Vol. 1,,8.2,"Action,Crime,Drama",2003,111,"After awakening from a four-year coma, a former assassin wreaks vengeance on the team of assassins who betrayed her.",Quentin Tarantino,"Uma Thurman,David Carradine,Daryl Hannah,Michael Madsen,Lucy Liu,Vivica A. Fox,Julie Dreyfus,Chiaki Kuriyama,Shin'ichi Chiba,Chia-Hui Liu,Michael Parks,Michael Bowen,Jun Kunimura,Kenji Ôba,Yuki Kazamatsuri,James Parks,Sakichi Sato,Jonathan Loughran",R,United States,"English,Japanese,French"
Jurassic Park,,8.2,"Action,Adventure,Sci-Fi",1993,127,A pragmatic paleontologist touring an almost complete theme park on an island in Central America is tasked with protecting a couple of kids after a power failure causes the park's cloned dinosaurs to run loose.,Steven Spielberg,"Sam Neill,Laura Dern,Jeff Goldblum,Richard Attenborough,Bob Peck,Martin Ferrero,BD Wong,Joseph Mazzello,Ariana Richards,Samuel L. Jackson,Wayne Knight,Gerald R. Molen,Miguel Sandoval,Cameron Thor,Christopher John Fields,Whit Hertford,Dean Cundey,Jophery C. Brown",PG-13,United States,"English,Spanish"
No Country for Old Men,,8.2,"Crime,Drama,Thriller",2007,122,Violence and mayhem ensue after a hunter stumbles upon a drug deal gone wrong and more than two million dollars in cash near the Rio Grande.,"Ethan Coen,Joel Coen","Tommy Lee Jones,Javier Bardem,Josh Brolin,Woody Harrelson,Kelly Macdonald,Garret Dillahunt,Tess Harper,Barry Corbin,Stephen Root,Rodger Boyce,Beth Grant,Ana Reeder,Kit Gwin,Zach Hopkins,Chip Love,Eduardo Antonio Garcia,Gene Jones,Myk Watford",R,United States,"English,Spanish"
Spider-Man: No Way Home,,8.3,"Action,Adventure,Fantasy",2021,148,"With Spider-Man's identity now revealed, Peter asks Doctor Strange for help. When a spell goes wrong, dangerous foes from other worlds start to appear, forcing Peter to discover what it truly means to be Spider-Man.",Jon Watts,"Tom Holland,Zendaya,Benedict Cumberbatch,Jacob Batalon,Jon Favreau,Jamie Foxx,Willem Dafoe,Alfred Molina,Benedict Wong,Tony Revolori,Marisa Tomei,Andrew Garfield,Tobey Maguire,Angourie Rice,Arian Moayed,Paula Newsome,Hannibal Buress,Martin Starr",PG-13,United States,English
A Beautiful Mind,,8.2,"Biography,Drama",2001,135,"After John Nash, a brilliant but asocial mathematician, accepts secret work in cryptography, his life takes a turn for the nightmarish.",Ron Howard,"Russell Crowe,Ed Harris,Jennifer Connelly,Christopher Plummer,Paul Bettany,Adam Goldberg,Josh Lucas,Anthony Rapp,Jason Gray-Stanford,Judd Hirsch,Austin Pendleton,Vivien Cardone,Jillie Simon,Victor Steinbach,Tanya Clarke,Thomas F. Walsh,Jesse Doran,Kent Cassella",PG-13,United States,English
The Truman Show,,8.2,"Comedy,Drama",1998,103,An insurance salesman discovers his whole life is actually a reality TV show.,Peter Weir,"Jim Carrey,Ed Harris,Laura Linney,Noah Emmerich,Natascha McElhone,Holland Taylor,Brian Delate,Blair Slater,Peter Krause,Heidi Schanz,Ron Taylor,Don Taylor,Ted Raymond,Judy Clayton,Fritz Dominique,Angel Schmiedt,Nastassja Schmiedt,Muriel Moore",PG,United States,English
Shutter Island,,8.2,"Mystery,Thriller",2010,138,"In 1954, a U.S. Marshal investigates the disappearance of a murderer who escaped from a hospital for the criminally insane.",Martin Scorsese,"Leonardo DiCaprio,Emily Mortimer,Mark Ruffalo,Ben Kingsley,Max von Sydow,Michelle Williams,Patricia Clarkson,Jackie Earle Haley,Ted Levine,John Carroll Lynch,Elias Koteas,Robin Bartlett,Christopher Denham,Nellie Sciutto,Joseph Sikora,Curtiss Cook,Raymond Anthony Thomas,Joseph McKenna",R,United States,"English,German"
Monty Python and the Holy Grail,,8.2,"Adventure,Comedy,Fantasy",1975,91,"King Arthur and his Knights of the Round Table embark on a surreal, low-budget search for the Holy Grail, encountering many, very silly obstacles.","Terry Gilliam,Terry Jones","Graham Chapman,John Cleese,Eric Idle,Terry Gilliam,Terry Jones,Michael Palin,Connie Booth,Carol Cleveland,Neil Innes,Bee Duffell,John Young,Rita Davies,Avril Stewart,Sally Kinghorn,Mark Zycon,Elspeth Cameron,Mitsuko Forstater,Sandy Johnson",PG,United Kingdom,"English,French,Latin,Swedish"
The Sixth Sense,,8.2,"Drama,Mystery,Thriller",1999,107,"A frightened, withdrawn Philadelphia boy who communicates with spirits seeks the help of a disheartened child psychologist.",M. Night Shyamalan,"Bruce Willis,Haley Joel Osment,Toni Collette,Olivia Williams,Trevor Morgan,Donnie Wahlberg,Peter Anthony Tambakis,Jeffrey Zubernis,Bruce Norris,Glenn Fitzgerald,Greg Wood,Mischa Barton,Angelica Page,Lisa Summerour,Firdous Bamji,Samia Shoaib,Hayden Saunier,Janis Dardaris",PG-13,United States,"English,Latin,Spanish"
The Treasure of the Sierra Madre,,8.2,"Adventure,Drama,Western",1948,126,Two down-on-their-luck Americans searching for work in 1920s Mexico convince an old prospector to help them mine for gold in the Sierra Madre Mountains.,John Huston,"Humphrey Bogart,Walter Huston,Tim Holt,Bruce Bennett,Barton MacLane,Alfonso Bedoya,Arturo Soto Rangel,Manuel Dondé,José Torvay,Margarito Luna,Robert Blake,Guillermo Calles,Roberto Cañedo,Spencer Chan,Jacqueline Dalya,Ralph Dunn,Ernesto Escoto,Pat Flaherty",Passed,United States,"English,Spanish"
Yojimbo,Yôjinbô,8.2,"Action,Drama,Thriller",1961,110,A crafty ronin comes to a town divided by two criminal gangs and decides to play them against each other to free the town.,Akira Kurosawa,"Toshirô Mifune,Eijirô Tôno,Tatsuya Nakadai,Yôko Tsukasa,Isuzu Yamada,Daisuke Katô,Seizaburô Kawazu,Takashi Shimura,Hiroshi Tachikawa,Yôsuke Natsuki,Kamatari Fujiwara,Ikio Sawamura,Atsushi Watanabe,Susumu Fujita,Kyû Sazanka,Kô Nishimura,Takeshi Katô,Ichirô Nakatani",Not Rated,Japan,Japanese
There Will Be Blood,,8.2,Drama,2007,158,"A story of family, religion, hatred, oil and madness, focusing on a turn-of-the-century prospector in the early days of the business.",Paul Thomas Anderson,"Daniel Day-Lewis,Paul Dano,Ciarán Hinds,Martin Stringer,Matthew Braden Stringer,Jacob Stringer,Joseph Mussey,Barry Del Sherman,Harrison Taylor,Stockton Taylor,Paul F. Tompkins,Dillon Freasier,Kevin Breznahan,Jim Meskimen,Erica Sullivan,Randall Carver,Coco Leigh,Sydney McCallister",R,United States,"English,American Sign Language"
Unforgiven,,8.2,"Drama,Western",1992,130,"Retired Old West gunslinger William Munny reluctantly takes on one last job, with the help of his old partner Ned Logan and a young man, The ""Schofield Kid.""",Clint Eastwood,"Clint Eastwood,Gene Hackman,Morgan Freeman,Richard Harris,Jaimz Woolvett,Saul Rubinek,Frances Fisher,Anna Thomson,David Mucci,Rob Campbell,Anthony James,Tara Frederick,Beverley Elliott,Liisa Repo-Martell,Josie Smith,Shane Meier,Aline Levasseur,Cherrilene Cardinal",R,United States,English
Casino,,8.2,"Crime,Drama",1995,178,"A tale of greed, deception, money, power, and murder occur between two best friends: a mafia enforcer and a casino executive compete against each other over a gambling empire, and over a fast-living and fast-loving socialite.",Martin Scorsese,"Robert De Niro,Sharon Stone,Joe Pesci,James Woods,Don Rickles,Alan King,Kevin Pollak,L.Q. Jones,Dick Smothers,Frank Vincent,John Bloom,Pasquale Cajano,Melissa Prophet,Bill Allison,Vinny Vella,Philip Suriano,Erika von Tagen,Frankie Avalon",R,"United States,France",English
Ran,,8.2,"Action,Drama,War",1985,162,"In Medieval Japan, an elderly warlord retires, handing over his empire to his three sons. However, he vastly underestimates how the new-found power will corrupt them and cause them to turn on each other...and him.",Akira Kurosawa,"Tatsuya Nakadai,Akira Terao,Jinpachi Nezu,Daisuke Ryû,Mieko Harada,Yoshiko Miyazaki,Hisashi Igawa,Pîtâ,Masayuki Yui,Kazuo Katô,Norio Matsui,Toshiya Ito,Kenji Kodama,Takashi Watanabe,Mansai Nomura,Takeshi Katô,Jun Tazaki,Hitoshi Ueki",R,"Japan,France",Japanese
Pan's Labyrinth,El laberinto del fauno,8.2,"Drama,Fantasy,War",2006,118,"In the Falangist Spain of 1944, the bookish young stepdaughter of a sadistic army officer escapes into an eerie but captivating fantasy world.",Guillermo del Toro,"Ivana Baquero,Ariadna Gil,Sergi López,Maribel Verdú,Doug Jones,Álex Angulo,Manolo Solo,César Vea,Roger Casamajor,Ivan Massagué,Gonzalo Uriarte,Eusebio Lázaro,Francisco Vidal,Juanjo Cucalón,Lina Mira,Mario Zorrilla,Sebastián Haro,Mila Espiga",R,"Mexico,Spain",Spanish
Green Book,,8.2,"Biography,Comedy,Drama",2018,130,A working-class Italian-American bouncer becomes the driver for an African-American classical pianist on a tour of venues through the 1960s American South.,Peter Farrelly,"Viggo Mortensen,Mahershala Ali,Linda Cardellini,Sebastian Maniscalco,Dimiter D. Marinov,Mike Hatton,P.J. Byrne,Joe Cortese,Maggie Nixon,Von Lewis,Jon Sortland,Don Stark,Anthony Mangano,Paul Sloan,Quinn Duffy,Seth Hurwitz,Hudson Galloway,Gavin Lyle Foley",PG-13,"United States,China","English,Italian,Russian,German"
The Wolf of Wall Street,,8.2,"Biography,Comedy,Crime",2013,180,"Based on the true story of Jordan Belfort, from his rise to a wealthy stock-broker living the high life to his fall involving crime, corruption and the federal government.",Martin Scorsese,"Leonardo DiCaprio,Jonah Hill,Margot Robbie,Matthew McConaughey,Kyle Chandler,Rob Reiner,Jon Bernthal,Jon Favreau,Jean Dujardin,Joanna Lumley,Cristin Milioti,Christine Ebersole,Shea Whigham,Katarina Cas,P.J. Byrne,Kenneth Choi,Brian Sacca,Henry Zebrowski",R,United States,"English,French"
Judgment at Nuremberg,,8.3,"Drama,War",1961,179,"In 1948, an American court in occupied Germany tries four Nazis judged for war crimes.",Stanley Kramer,"Spencer Tracy,Burt Lancaster,Richard Widmark,Marlene Dietrich,Maximilian Schell,Judy Garland,Montgomery Clift,William Shatner,Werner Klemperer,Kenneth MacKenna,Torben Meyer,Joseph Bernard,Alan Baxter,Edward Binns,Virginia Christine,Otto Waldis,Karl Swenson,Martin Brandt",Approved,United States,"English,German"
The Father,,8.2,"Drama,Mystery",2020,97,"A man refuses all assistance from his daughter as he ages. As he tries to make sense of his changing circumstances, he begins to doubt his loved ones, his own mind and even the fabric of his reality.",Florian Zeller,"Anthony Hopkins,Olivia Colman,Mark Gatiss,Olivia Williams,Imogen Poots,Rufus Sewell,Ayesha Dharker,Roman Zeller,Adnan Kundi,Brian Rodger,Evie Wray",PG-13,"United Kingdom,France,United States",English
Dangal,,8.3,"Action,Biography,Drama",2016,161,Former wrestler Mahavir Singh Phogat and his two wrestler daughters struggle towards glory at the Commonwealth Games in the face of societal oppression.,Nitesh Tiwari,"Aamir Khan,Sakshi Tanwar,Fatima Sana Shaikh,Sanya Malhotra,Aparshakti Khurana,Zaira Wasim,Suhani Bhatnagar,Ritvik Sahore,Girish Kulkarni,Ravi Aneja,Anurag Arora,Mahesh Balraj,Vivan Bhatena,Anmol Charan,Karamveer Choudhary,Ishika Gagneja,Badrul Islam,Jagbir",Not Rated,"India,United States","Hindi,English"
All About Eve,,8.2,Drama,1950,138,A seemingly timid but secretly ruthless ingénue insinuates herself into the lives of an aging Broadway star and her circle of theater friends.,Joseph L. Mankiewicz,"Bette Davis,Anne Baxter,George Sanders,Celeste Holm,Gary Merrill,Hugh Marlowe,Gregory Ratoff,Barbara Bates,Marilyn Monroe,Thelma Ritter,Walter Hampden,Randy Stuart,Craig Hill,Leland Harris,Barbara White,Eddie Fisher,William Pullen,Claude Stroud",Passed,United States,"English,French"
Batman Begins,,8.2,"Action,Crime,Drama",2005,140,"After training with his mentor, Batman begins his fight to free crime-ridden Gotham City from corruption.",Christopher Nolan,"Christian Bale,Michael Caine,Ken Watanabe,Liam Neeson,Katie Holmes,Gary Oldman,Cillian Murphy,Tom Wilkinson,Rutger Hauer,Mark Boone Junior,Linus Roache,Morgan Freeman,Larry Holden,Gerard Murphy,Colin McFarlane,Sara Stewart,Gus Lewis,Richard Brake",PG-13,"United States,United Kingdom","English,Mandarin"
The Kid,,8.3,"Comedy,Drama,Family",1921,68,"The Tramp cares for an abandoned child, but events put their relationship in jeopardy.",Charles Chaplin,"Charles Chaplin,Edna Purviance,Jackie Coogan,Carl Miller,Albert Austin,Beulah Bains,Nellie Bly Baker,Henry Bergman,Edward Biby,B.F. Blinn,Kitty Bradbury,Frank Campeau,Bliss Chevalier,Frances Cochran,Elsie Codd,Jack Coogan Sr.,Estelle Cook,Lillian Crane",Passed,United States,English
Some Like It Hot,,8.2,"Comedy,Music,Romance",1959,121,"After two male musicians witness a mob hit, they flee the state in an all-female band disguised as women, but further complications set in.",Billy Wilder,"Marilyn Monroe,Tony Curtis,Jack Lemmon,George Raft,Pat O'Brien,Joe E. Brown,Nehemiah Persoff,Joan Shawlee,Billy Gray,George E. Stone,Dave Barry,Mike Mazurki,Harry Wilson,Beverly Wills,Barbara Drew,Edward G. Robinson Jr.,Sam Bagley,Brandon Beach",Passed,United States,English
For a Few Dollars More,Per qualche dollaro in più,8.2,Western,1965,132,Two bounty hunters with the same intentions team up to track down an escaped Mexican outlaw.,Sergio Leone,"Clint Eastwood,Lee Van Cleef,Gian Maria Volontè,Mara Krupp,Luigi Pistilli,Klaus Kinski,Luis Rodríguez,Benito Stefanelli,Panos Papadopulos,Aldo Sambrell,Roberto Camardiel,Joseph Egger,Tomás Blanco,Lorenzo Robledo,Dante Maggio,Sergio Mendizábal,Diana Rabito,Giovanni Tarallo",R,"Italy,Spain,West Germany","Italian,English"
1917,,8.2,"Action,Drama,War",2019,119,"April 6th, 1917. As an infantry battalion assembles to wage war deep in enemy territory, two soldiers are assigned to race against time and deliver a message that will stop 1,600 men from walking straight into a deadly trap.",Sam Mendes,"Dean-Charles Chapman,George MacKay,Daniel Mays,Colin Firth,Pip Carter,Andy Apollo,Paul Tinto,Josef Davies,Billy Postlethwaite,Gabriel Akuwudike,Andrew Scott,Spike Leighton,Robert Maaser,Gerran Howell,Adam Hugill,Mark Strong,Richard McCabe,Benjamin Adams",R,"United Kingdom,United States,India,Spain","English,French,German"
Downfall,Der Untergang,8.2,"Biography,Drama,History",2004,156,"Traudl Junge, the final secretary for Adolf Hitler, tells of the Nazi dictator's final days in his Berlin bunker at the end of WWII.",Oliver Hirschbiegel,"Bruno Ganz,Alexandra Maria Lara,Ulrich Matthes,Juliane Köhler,Corinna Harfouch,Heino Ferch,Christian Berkel,Matthias Habich,Thomas Kretschmann,Michael Mendl,André Hennicke,Ulrich Noethen,Birgit Minichmayr,Rolf Kanies,Justus von Dohnányi,Dieter Mann,Christian Redl,Götz Otto",R,"Germany,Austria,Italy","German,Russian,French,English"
Like Stars on Earth,Taare Zameen Par,8.4,"Drama,Family",2007,165,"An eight-year-old boy is thought to be a lazy trouble-maker, until the new art teacher has the patience and compassion to discover the real problem behind his struggles in school.","Aamir Khan,Amole Gupte","Darsheel Safary,Aamir Khan,Tisca Chopra,Vipin Sharma,Sachet Engineer,Tanay Chheda,Lalitha Lajmi,Girija Oak,Ravi Khanvilkar,Pratima Kulkarni,Meghna Malik,Sonali Sachdev,Sanjay Dadhich,Rajgopal Iyer,Bugs Bhargava Krishna,Shankar Sachdev,M.K. Raina,Gurkirtan",PG,India,Hindi
Indiana Jones and the Last Crusade,,8.2,"Action,Adventure",1989,127,"In 1938, after his father Professor Henry Jones, Sr. goes missing while pursuing the Holy Grail, Professor Henry ""Indiana"" Jones, Jr. finds himself up against Adolf Hitler's Nazis again to stop them from obtaining its powers.",Steven Spielberg,"Harrison Ford,Sean Connery,Alison Doody,Denholm Elliott,John Rhys-Davies,Julian Glover,River Phoenix,Michael Byrne,Kevork Malikyan,Robert Eddison,Richard Young,Alexei Sayle,Alex Hyde-White,Paul Maxwell,Isla Blair,Vernon Dobtcheff,J.J. Hardy,Bradley Gregg",PG-13,United States,"English,German,Greek,Arabic"
Bicycle Thieves,Ladri di biciclette,8.3,Drama,1948,89,"In post-war Italy, a working-class man's bicycle is stolen, endangering his efforts to find work. He and his son set out to find it.",Vittorio De Sica,"Lamberto Maggiorani,Enzo Staiola,Lianella Carell,Elena Altieri,Gino Saltamerenda,Giulio Chiari,Vittorio Antonucci,Michele Sakara,Fausto Guerzoni,Emma Druetti,Carlo Jachino,Giulio Battiferri,Ida Bracci Dorati,Nando Bruno,Eolo Capritti,Memmo Carotenuto,Giovanni Corporale,Veriano Ginesi",Not Rated,Italy,"Italian,English,German"
