title,original_title,score,genres,release_year,length_in_minutes,synopsis,directors,actors,public,countries_of_origin,original_languages
The Shawshank Redemption,,9.3,Drama,1994,142,"Two imprisoned men bond over a number of years, finding solace and eventual redemption through acts of common decency.",Frank Darabont,"Tim Robbins,Morgan Freeman,Bob Gunton,William Sadler,Clancy Brown,Gil Bellows,Mark Rolston,James Whitmore,Jeffrey DeMunn,Larry Brandenburg,Neil Giuntoli,Brian Libby,David Proval,Joseph Ragno,Jude Ciccolella,Paul McCrane,Renee Blaine,Scott Mann",R,United States,English
Star Wars: Episode IV - A New Hope,Star Wars,8.6,"Action,Adventure,Fantasy",1977,121,"Luke Skywalker joins forces with a Jedi Knight, a cocky pilot, a Wookiee and two droids to save the galaxy from the Empire's world-destroying battle station, while also attempting to rescue Princess Leia from the mysterious Darth Vader.",George Lucas,"Mark Hamill,Harrison Ford,Carrie Fisher,Alec Guinness,Peter Cushing,Anthony Daniels,Kenny Baker,Peter Mayhew,David Prowse,Phil Brown,Shelagh Fraser,Jack Purvis,Alex McCrindle,Eddie Byrne,Drewe Henley,Denis Lawson,Garrick Hagon,Jack Klaff",PG,United States,English
The Pianist,,8.5,"Biography,Drama,Music",2002,150,A Polish Jewish musician struggles to survive the destruction of the Warsaw ghetto of World War II.,Roman Polanski,"Adrien Brody,Thomas Kretschmann,Frank Finlay,Emilia Fox,Michal Zebrowski,Ed Stoppard,Maureen Lipman,Jessica Kate Meyer,Julia Rayner,Wanja Mues,Richard Ridings,Nomi Sharron,Anthony Milner,Lucy Skeaping,Roddy Skeaping,Ben Harlan,Thomas Lawinky,Joachim Paul Assböck",R,"France,Poland,Germany,United Kingdom","English,German,Russian"
Psycho,,8.5,"Horror,Mystery,Thriller",1960,109,"A Phoenix secretary embezzles $40,000 from her employer's client, goes on the run and checks into a remote motel run by a young man under the domination of his mother.",Alfred Hitchcock,"Anthony Perkins,Janet Leigh,Vera Miles,John Gavin,Martin Balsam,John McIntire,Simon Oakland,Frank Albertson,Patricia Hitchcock,Vaughn Taylor,Lurene Tuttle,John Anderson,Mort Mills,Fletcher Allen,Walter Bacon,Prudence Beers,Kit Carson,Francis De Sales",R,United States,English
Back to the Future,,8.5,"Adventure,Comedy,Sci-Fi",1985,116,"Marty McFly, a 17-year-old high school student, is accidentally sent 30 years into the past in a time-traveling DeLorean invented by his close friend, the maverick scientist Doc Brown.",Robert Zemeckis,"Michael J. Fox,Christopher Lloyd,Lea Thompson,Crispin Glover,Tom Wilson,Claudia Wells,Marc McClure,Wendie Jo Sperber,George DiCenzo,Frances Lee McCain,James Tolkan,J.J. Cohen,Casey Siemaszko,Billy Zane,Harry Waters Jr.,Donald Fullilove,Lisa Freeman,Cristen Kauffman",PG,United States,English
Spirited Away,Sen to Chihiro no kamikakushi,8.6,"Animation,Adventure,Family",2001,125,"During her family's move to the suburbs, a sullen 10-year-old girl wanders into a world ruled by gods, witches, and spirits, and where humans are changed into beasts.",Hayao Miyazaki,"Daveigh Chase,Suzanne Pleshette,Miyu Irino,Rumi Hiiragi,Mari Natsuki,Takashi Naitô,Yasuko Sawaguchi,Tatsuya Gashûin,Ryûnosuke Kamiki,Yumi Tamai,Yô Ôizumi,Koba Hayashi,Tsunehiko Kamijô,Takehiko Ono,Bunta Sugawara,Shigeru Wakita,Shirô Saitô,Michiko Yamamoto",PG,Japan,"Japanese,English"
The Green Mile,,8.6,"Crime,Drama,Fantasy",1999,189,"The lives of guards on Death Row are affected by one of their charges: a black man accused of child murder and rape, yet who has a mysterious gift.",Frank Darabont,"Tom Hanks,Michael Clarke Duncan,David Morse,Bonnie Hunt,James Cromwell,Michael Jeter,Graham Greene,Doug Hutchison,Sam Rockwell,Barry Pepper,Jeffrey DeMunn,Patricia Clarkson,Harry Dean Stanton,Dabbs Greer,Eve Brent,William Sadler,Mack Miles,Rai Tasco",R,United States,"English,French"
Terminator 2: Judgment Day,,8.6,"Action,Sci-Fi",1991,137,"A cyborg, identical to the one who failed to kill Sarah Connor, must now protect her 10-year old adolescent son John from an even more advanced and powerful cyborg.",James Cameron,"Arnold Schwarzenegger,Linda Hamilton,Edward Furlong,Robert Patrick,Earl Boen,Joe Morton,S. Epatha Merkerson,Castulo Guerra,Danny Cooksey,Jenette Goldstein,Xander Berkeley,Leslie Hamilton Gearren,Ken Gibbel,Robert Winley,Peter Schrum,Shane Wilder,Michael Edwards,Jared Lounsbery",R,United States,"English,Spanish"
Interstellar,,8.6,"Adventure,Drama,Sci-Fi",2014,169,A team of explorers travel through a wormhole in space in an attempt to ensure humanity's survival.,Christopher Nolan,"Matthew McConaughey,Anne Hathaway,Jessica Chastain,Mackenzie Foy,Ellen Burstyn,John Lithgow,Timothée Chalamet,David Oyelowo,Collette Wolfe,Francis X. McCarthy,Bill Irwin,Andrew Borba,Wes Bentley,William Devane,Michael Caine,David Gyasi,Josh Stewart,Casey Affleck",PG-13,"United States,United Kingdom,Canada",English
Life Is Beautiful,La vita è bella,8.6,"Comedy,Drama,Romance",1997,116,"When an open-minded Jewish waiter and his son become victims of the Holocaust, he uses a perfect mixture of will, humor, and imagination to protect his son from the dangers around their camp.",Roberto Benigni,"Roberto Benigni,Nicoletta Braschi,Giorgio Cantarini,Giustino Durano,Sergio Bini Bustric,Marisa Paredes,Horst Buchholz,Lidia Alfonsi,Giuliana Lojodice,Amerigo Fontani,Pietro De Silva,Francesco Guzzo,Raffaella Lebboroni,Claudio Alfonsi,Gil Baroni,Massimo Bianchi,Jürgen Bohn,Verena Buratti",PG-13,Italy,"Italian,German,English"
Saving Private Ryan,,8.6,"Drama,War",1998,169,"Following the Normandy Landings, a group of U.S. soldiers go behind enemy lines to retrieve a paratrooper whose brothers have been killed in action.",Steven Spielberg,"Tom Hanks,Matt Damon,Tom Sizemore,Edward Burns,Barry Pepper,Adam Goldberg,Vin Diesel,Giovanni Ribisi,Jeremy Davies,Ted Danson,Paul Giamatti,Dennis Farina,Joerg Stadler,Max Martini,Dylan Bruno,Daniel Cerqueira,Demetri Goritsas,Ian Porter",R,United States,"English,French,German,Czech"
City of God,Cidade de Deus,8.6,"Crime,Drama",2002,130,"In the slums of Rio, two kids' paths diverge as one struggles to become a photographer and the other a kingpin.","Fernando Meirelles,Kátia Lund","Alexandre Rodrigues,Leandro Firmino,Matheus Nachtergaele,Phellipe Haagensen,Douglas Silva,Jonathan Haagensen,Seu Jorge,Jefechander Suplino,Alice Braga,Emerson Gomes,Edson Oliveira,Michel Gomes,Roberta Rodrigues,Luis Otávio,Kiko Marques,Gustavo Engrácia,Darlan Cunha,Robson Rocha",R,"Brazil,France,Germany",Portuguese
Seven Samurai,Shichinin no samurai,8.6,"Action,Drama",1954,207,"Farmers from a village exploited by bandits hire a veteran samurai for protection, who gathers six other samurai to join him.",Akira Kurosawa,"Toshirô Mifune,Takashi Shimura,Keiko Tsushima,Yukiko Shimazaki,Kamatari Fujiwara,Daisuke Katô,Isao Kimura,Minoru Chiaki,Seiji Miyaguchi,Yoshio Kosugi,Bokuzen Hidari,Yoshio Inaba,Yoshio Tsuchiya,Kokuten Kôdô,Eijirô Tôno,Kichijirô Ueda,Jun Tatara,Atsushi Watanabe",Not Rated,Japan,Japanese
It's a Wonderful Life,,8.6,"Drama,Family,Fantasy",1946,130,An angel is sent from Heaven to help a desperately frustrated businessman by showing him what life would have been like if he had never existed.,Frank Capra,"James Stewart,Donna Reed,Lionel Barrymore,Thomas Mitchell,Henry Travers,Beulah Bondi,Frank Faylen,Ward Bond,Gloria Grahame,H.B. Warner,Frank Albertson,Todd Karns,Samuel S. Hinds,Mary Treen,Virginia Patton,Charles Williams,Sarah Edwards,William Edmunds",PG,United States,"English,French"
Se7en,,8.6,"Crime,Drama,Mystery",1995,127,"Two detectives, a rookie and a veteran, hunt a serial killer who uses the seven deadly sins as his motives.",David Fincher,"Morgan Freeman,Brad Pitt,Kevin Spacey,Andrew Kevin Walker,Daniel Zacapa,Gwyneth Paltrow,John Cassini,Bob Mack,Peter Crombie,Reg E. Cathey,R. Lee Ermey,George Christy,Endre Hules,Hawthorne James,William Davidson,Bob Collins,Jimmy Dale Hartsell,Richard Roundtree",R,United States,English
The Help,,8.1,Drama,2011,146,"An aspiring author during the civil rights movement of the 1960s decides to write a book detailing the African American maids' point of view on the white families for which they work, and the hardships they go through on a daily basis.",Tate Taylor,"Viola Davis,Emma Stone,Octavia Spencer,Bryce Dallas Howard,Jessica Chastain,Ahna O'Reilly,Allison Janney,Anna Camp,Eleanor Henry,Emma Henry,Christopher Lowell,Cicely Tyson,Mike Vogel,Sissy Spacek,Brian Kerwin,Wes Chatham,Aunjanue Ellis,Ted Welch",PG-13,"United States,India",English
Gandhi,,8.1,"Biography,Drama,History",1982,191,The life of the lawyer who became the famed leader of the Indian revolts against the British rule through his philosophy of nonviolent protest.,Richard Attenborough,"Ben Kingsley,John Gielgud,Rohini Hattangadi,Roshan Seth,Candice Bergen,Edward Fox,Trevor Howard,John Mills,Martin Sheen,Ian Charleson,Günther Maria Halmer,Athol Fugard,Saeed Jaffrey,Geraldine James,Alyque Padamsee,Amrish Puri,Ian Bannen,Michael Bryant",PG,"United Kingdom,India,United States,South Africa","English,Hindi"
The Iron Giant,,8.1,"Animation,Action,Adventure",1999,86,A young boy befriends a giant robot from outer space that a paranoid government agent wants to destroy.,Brad Bird,"Eli Marienthal,Harry Connick Jr.,Jennifer Aniston,Vin Diesel,James Gammon,Cloris Leachman,Christopher McDonald,John Mahoney,M. Emmet Walsh,Jack Angel,Bob Bergen,Mary Kay Bergman,Michael Bird,Devon Cole Borisoff,Rodger Bumpass,Robert Clotworthy,Jennifer Darling,Zack Eginton",PG,United States,English
Dersu Uzala,,8.2,"Adventure,Biography,Drama",1975,142,The Russian army sends an explorer on an expedition to the snowy Siberian wilderness where he makes friends with a seasoned local hunter.,Akira Kurosawa,"Maksim Munzuk,Yuriy Solomin,Mikhail Bychkov,Vladimir Khrulyov,V. Lastochkin,Stanislav Marin,Igor Sykhra,Vladimir Sergiyakov,Yanis Yakobsons,Vladimir Khlestov,G. Polunin,V. Koldin,M. Tetov,S. Sinyavskiy,Vladimir Sverba,V. Ignatov,Vladimir Kremena,Aleksandr Pyatkov",G,"Soviet Union,Japan","Russian,Chinese"
The Silence of the Lambs,,8.6,"Crime,Drama,Thriller",1991,118,"A young F.B.I. cadet must receive the help of an incarcerated and manipulative cannibal killer to help catch another serial killer, a madman who skins his victims.",Jonathan Demme,"Jodie Foster,Anthony Hopkins,Lawrence A. Bonney,Kasi Lemmons,Lawrence T. Wrentz,Scott Glenn,Anthony Heald,Frankie Faison,Don Brockett,Frank Seals Jr.,Stuart Rudin,Maria Skorobogatov,Jeffrie Lane,Leib Lensky,George 'Red' Schwartz,Jim Roche,Brooke Smith,Ted Levine",R,United States,"English,Latin"
Aladdin,,8.0,"Animation,Adventure,Comedy",1992,90,A kindhearted street urchin and a power-hungry Grand Vizier vie for a magic lamp that has the power to make their deepest wishes come true.,"Ron Clements,John Musker","Scott Weinger,Robin Williams,Linda Larkin,Jonathan Freeman,Frank Welker,Gilbert Gottfried,Douglas Seale,Charlie Adler,Jack Angel,Corey Burton,Philip L. Clarke,Jim Cummings,Jennifer Darling,Debi Derryberry,Bruce Gooch,Jerry Houser,Vera Lockwood,Sherry Lynn",G,United States,English
Everything Everywhere All at Once,,8.1,"Action,Adventure,Comedy",2022,139,"An aging Chinese immigrant is swept up in an insane adventure, in which she alone can save the world by exploring other universes connecting with the lives she could have led.","Dan Kwan,Daniel Scheinert","Michelle Yeoh,Stephanie Hsu,Jamie Lee Curtis,Ke Huy Quan,James Hong,Tallie Medel,Jenny Slate,Harry Shum Jr.,Randy Newman,Biff Wiff,Sunita Mani,Aaron Lazar,Brian Le,Andy Le,Narayana Cabral,Chelsey Goldsmith,Craig Henningsen,Anthony Molinari",R,United States,"English,Mandarin,Cantonese"
It Happened One Night,,8.1,"Comedy,Romance",1934,105,"A renegade reporter trailing a young runaway heiress for a big story joins her on a bus heading from Florida to New York, and they end up stuck with each other when the bus leaves them behind at one of the stops.",Frank Capra,"Clark Gable,Claudette Colbert,Walter Connolly,Roscoe Karns,Jameson Thomas,Alan Hale,Arthur Hoyt,Blanche Friderici,Charles C. Wilson,Ernie Adams,Jessie Arnold,Irving Bacon,William Bailey,William Begg,William A. Boardway,Ward Bond,Harry C. Bradley,George P. Breakston",Passed,United States,English
Life of Brian,,8.0,Comedy,1979,94,"Born on the original Christmas in the stable next door to Jesus Christ, Brian of Nazareth spends his life being mistaken for a messiah.",Terry Jones,"Graham Chapman,John Cleese,Michael Palin,Terry Gilliam,Eric Idle,Terry Jones,Terence Bayler,Carol Cleveland,Kenneth Colley,Neil Innes,Charles McKeown,John Young,Gwen Taylor,Sue Jones-Davies,Peter Brett,John Case,Chris Langham,Andrew MacLachlan",R,United Kingdom,"English,Latin"
The Sound of Music,,8.1,"Biography,Drama,Family",1965,172,A young novitiate is sent by her convent in 1930s Austria to become a governess to the seven children of a widowed naval officer.,Robert Wise,"Julie Andrews,Christopher Plummer,Eleanor Parker,Richard Haydn,Peggy Wood,Charmian Carr,Heather Menzies-Urich,Nicholas Hammond,Duane Chase,Angela Cartwright,Debbie Turner,Kym Karath,Anna Lee,Portia Nelson,Ben Wright,Daniel Truhitte,Norma Varden,Gilchrist Stuart",G,United States,"English,German"
The 400 Blows,Les quatre cents coups,8.1,"Crime,Drama",1959,99,"A young boy, left without attention, delves into a life of petty crime.",François Truffaut,"Jean-Pierre Léaud,Albert Rémy,Claire Maurier,Guy Decomble,Georges Flamant,Patrick Auffay,Daniel Couturier,François Nocher,Richard Kanayan,Renaud Fontanarosa,Michel Girard,Serge Moati,Bernard Abbou,Jean-François Bergouignan,Michel Lesignor,Luc Andrieux,Robert Beauvais,Bouchon",Not Rated,France,"French,English"
The Handmaiden,Ah-ga-ssi,8.1,"Drama,Romance,Thriller",2016,145,"A woman is hired as a handmaiden to a Japanese heiress, but secretly she is involved in a plot to defraud her.",Park Chan-wook,"Kim Min-hee,Ha Jung-woo,Cho Jin-woong,Moon So-ri,Kim Tae-ri,Yong-nyeo Lee,Min-chae Yoo,Dong-hwi Lee,Kim Hae-sook,Kyu-jung Lee,Si-eun Kim,Si-yeon Ha,Rina Takagi,Geun-hee Won,Jong-Dae Kim,Han-sun Jang,Eun-yeong Kim,Ri-woo Kim",Not Rated,South Korea,"Korean,Japanese"
Cool Hand Luke,,8.1,"Crime,Drama",1967,127,"A laid back Southern man is sentenced to two years in a rural prison, but refuses to conform.",Stuart Rosenberg,"Paul Newman,George Kennedy,Strother Martin,J.D. Cannon,Lou Antonio,Robert Drivas,Jo Van Fleet,Clifton James,Morgan Woodward,Luke Askew,Marc Cavell,Richard Davalos,Robert Donner,Warren Finnerty,Dennis Hopper,John McLiam,Wayne Rogers,Harry Dean Stanton",GP,United States,English
Persona,,8.1,"Drama,Thriller",1966,83,A nurse is put in charge of a mute actress and finds that their personae are melding together.,Ingmar Bergman,"Bibi Andersson,Liv Ullmann,Margaretha Krook,Gunnar Björnstrand,Jörgen Lindström",Not Rated,Sweden,"Swedish,English"
The Grapes of Wrath,,8.1,Drama,1940,129,"An Oklahoma family, driven off their farm by the poverty and hopelessness of the Dust Bowl, joins the westward migration to California, suffering the misfortunes of the homeless in the Great Depression.",John Ford,"Henry Fonda,Jane Darwell,John Carradine,Charley Grapewin,Dorris Bowdon,Russell Simpson,O.Z. Whitehead,John Qualen,Eddie Quillan,Zeffie Tilbury,Frank Sully,Frank Darien,Darryl Hickman,Shirley Mills,Roger Imhof,Grant Mitchell,Charles D. Brown,John Arledge",Passed,United States,English
Rebecca,,8.1,"Drama,Film-Noir,Mystery",1940,130,A self-conscious woman juggles adjusting to her new role as an aristocrat's wife and avoiding being intimidated by his first wife's spectral presence.,Alfred Hitchcock,"Laurence Olivier,Joan Fontaine,George Sanders,Judith Anderson,Nigel Bruce,Reginald Denny,C. Aubrey Smith,Gladys Cooper,Florence Bates,Melville Cooper,Leo G. Carroll,Leonard Carey,Lumsden Hare,Edward Fielding,Philip Winter,Forrester Harvey,Bunny Beatty,Billy Bevan",Approved,United States,"English,French"
Amores Perros,Amores perros,8.1,"Drama,Thriller",2000,154,"A horrific car accident connects three stories, each involving characters dealing with loss, regret, and life's harsh realities, all in the name of love.",Alejandro G. Iñárritu,"Emilio Echevarría,Gael García Bernal,Goya Toledo,Álvaro Guerrero,Vanessa Bauche,Jorge Salinas,Marco Pérez,Rodrigo Murray,Humberto Busto,Gerardo Campbell,Rosa María Bianchi,Dunia Saldívar,Adriana Barraza,José Sefami,Lourdes Echevarría,Laura Almela,Ricardo Dalmacci,Gustavo Sánchez Parra",R,Mexico,Spanish
My Father and My Son,Babam ve Oglum,8.2,"Drama,Family",2005,112,The family of a left-wing journalist is torn apart after the military coup of Turkey in 1980.,Çagan Irmak,"Çetin Tekindor,Fikret Kuskan,Hümeyra,Ege Tanman,Serif Sezer,Yetkin Dikinciler,Binnur Kaya,Mahmut Gökgöz,Nergis Çorakçi,Bilge Sen,Tuba Büyüküstün,Özge Özberk,Erdal Tosun,Halit Ergenç,Tugyan Akay Kavukçu,Ege Kaya,Muzaffer Demirel,Burak Akçakaya",Not Rated,Turkey,Turkish
Hachi: A Dog's Tale,,8.1,"Biography,Drama,Family",2009,93,A college professor bonds with an abandoned dog he takes into his home.,Lasse Hallström,"Richard Gere,Joan Allen,Cary-Hiroyuki Tagawa,Sarah Roemer,Jason Alexander,Erick Avari,Davenia McFadden,Robbie Sublett,Kevin DeCoste,Rob Degnan,Tora Hallström,Donna Sorbello,Frank S. Aronson,Troy Doherty,Ian Sherman,Timothy Crowe,Denece Ryland,Blake Friedman",G,"United Kingdom,United States","English,Japanese"
La haine,,8.1,"Crime,Drama",1995,98,24 hours in the lives of three young men in the French suburbs the day after a violent riot.,Mathieu Kassovitz,"Vincent Cassel,Hubert Koundé,Saïd Taghmaoui,Abdel Ahmed Ghili,Solo,Joseph Momo,Héloïse Rauth,Rywka Wajsbrot,Olga Abrego,Laurent Labasse,Choukri Gabteni,Nabil Ben Mhamed,Benoît Magimel,Médard Niang,Arash Mansour,Abdel-Moulah Boujdouni,Mathilde Vitry,Christian Moro",Not Rated,"France,United States",French
Pirates of the Caribbean: The Curse of the Black Pearl,,8.1,"Action,Adventure,Fantasy",2003,143,"Blacksmith Will Turner teams up with eccentric pirate ""Captain"" Jack Sparrow to save his love, the governor's daughter, from Jack's former pirate allies, who are now undead.",Gore Verbinski,"Johnny Depp,Geoffrey Rush,Orlando Bloom,Keira Knightley,Jack Davenport,Jonathan Pryce,Lee Arenberg,Mackenzie Crook,Damian O'Hare,Giles New,Angus Barnett,David Bailie,Michael Berry Jr.,Isaac C. Singleton Jr.,Kevin McNally,Treva Etienne,Zoe Saldana,Guy Siner",PG-13,United States,English
The Best Years of Our Lives,,8.1,"Drama,Romance,War",1946,170,"Three World War II veterans, two of them traumatized or disabled, return home to the American midwest to discover that they and their families have been irreparably changed.",William Wyler,"Myrna Loy,Dana Andrews,Fredric March,Teresa Wright,Virginia Mayo,Cathy O'Donnell,Hoagy Carmichael,Harold Russell,Gladys George,Roman Bohnen,Ray Collins,Minna Gombell,Walter Baldwin,Steve Cochran,Dorothy Adams,Don Beddoe,Marlene Aames,Charles Halton",Approved,United States,English
To Be or Not to Be,,8.2,"Comedy,Romance,War",1942,99,"During the Nazi occupation of Poland, an acting troupe becomes embroiled in a Polish soldier's efforts to track down a German spy.",Ernst Lubitsch,"Carole Lombard,Jack Benny,Robert Stack,Felix Bressart,Lionel Atwill,Stanley Ridges,Sig Ruman,Tom Dugan,Charles Halton,George Lynn,Henry Victor,Maude Eburne,Halliwell Hobbes,Miles Mander,Rudolph Anders,Paul Barrett,Sven Hugo Borg,Danny Borzage",Passed,United States,"English,German,French"
The Incredibles,,8.0,"Animation,Action,Adventure",2004,115,"While trying to lead a quiet suburban life, a family of undercover superheroes are forced into action to save the world.",Brad Bird,"Craig T. Nelson,Samuel L. Jackson,Holly Hunter,Jason Lee,Dominique Louis,Teddy Newton,Jean Sincere,Eli Fucile,Maeve Andrews,Wallace Shawn,Spencer Fox,Lou Romano,Wayne Canney,Sarah Vowell,Michael Bird,Elizabeth Peña,Bud Luckey,Brad Bird",PG,United States,"English,French"
Jai Bhim,,8.8,"Crime,Drama,Mystery",2021,164,"When a tribal man is arrested for a case of alleged theft, his wife turns to a human-rights lawyer to help bring justice.",T.J. Gnanavel,"Suriya,Lijo Mol Jose,Manikandan K.,Rajisha Vijayan,Prakash Raj,Rao Ramesh,Guru Somasundaram,M.S. Bhaskar,V. Jayaprakash,Sibi Thomas,Ilavarasu,Jayarao,Sujatha Sivakumar,Ravi Venkatraman,Tamizh,Kumaravel,Supergood Subramani,Bala Hasan",TV-MA,India,"Tamil,Hindi,Telugu"
The Battle of Algiers,La battaglia di Algeri,8.1,"Drama,War",1966,121,"In the 1950s, fear and violence escalate as the people of Algiers fight for independence from the French government.",Gillo Pontecorvo,"Brahim Hadjadj,Jean Martin,Yacef Saadi,Samia Kerbash,Ugo Paletti,Fusia El Kader,Mohamed Ben Kassen,Franco Moruzzi,Tommaso Neri,Rouïched,Gene Wesson",Not Rated,"Italy,Algeria","Arabic,French,English"
The Exorcist,,8.1,Horror,1973,122,"When a teenage girl is possessed by a mysterious entity, her mother seeks the help of two priests to save her daughter.",William Friedkin,"Ellen Burstyn,Max von Sydow,Linda Blair,Lee J. Cobb,Kitty Winn,Jack MacGowran,Jason Miller,William O'Malley,Barton Heyman,Peter Masterson,Rudolf Schündler,Gina Petrushka,Robert Symonds,Arthur Storch,Thomas Bermingham,Vasiliki Maliaros,Titos Vandis,John Mahon",R,United States,"English,Latin,Greek,French,German,Arabic,Kurdish"
Groundhog Day,,8.1,"Comedy,Drama,Fantasy",1993,101,"A narcissistic, self-centered weatherman finds himself in a time loop on Groundhog Day, and the day keeps repeating until he gets it right.",Harold Ramis,"Bill Murray,Andie MacDowell,Chris Elliott,Stephen Tobolowsky,Brian Doyle-Murray,Marita Geraghty,Angela Paton,Rick Ducommun,Rick Overton,Robin Duke,Carol Bivins,Willie Garson,Ken Hudson Campbell,Les Podewell,Rod Sell,Tom Milanovich,John M. Watson Sr.,Peggy Roeder",PG,United States,"English,French,Italian"
The Wizard of Oz,,8.1,"Adventure,Family,Fantasy",1939,102,"Young Dorothy Gale and her dog Toto are swept away by a tornado from their Kansas farm to the magical Land of Oz, and embark on a quest with three new friends to see the Wizard, who can return her to her home and fulfill the others' wishes.","Directors,Victor Fleming,George Cukor,Mervyn LeRoy","Judy Garland,Frank Morgan,Ray Bolger,Bert Lahr,Jack Haley,Billie Burke,Margaret Hamilton,Charley Grapewin,Pat Walshe,Clara Blandick,Terry,The Singer Midgets,Franz Balluck,Josefine Balluck,Dorothy Barrett,Amelia Batchelor,Charles Becker,Freda Betsky",G,United States,English
Network,,8.1,Drama,1976,121,"A television network cynically exploits a deranged former anchor's ravings and revelations about the news media for its own profit, but finds that his message may be difficult to control.",Sidney Lumet,"Faye Dunaway,William Holden,Peter Finch,Robert Duvall,Wesley Addy,Ned Beatty,Arthur Burghardt,Bill Burrows,John Carpenter,Jordan Charney,Kathy Cronkite,Ed Crowley,Jerome Dempsey,Conchata Ferrell,Gene Gross,Stanley Grover,Cindy Grover,Darryl Hickman",R,United States,English
Before Sunset,,8.1,"Drama,Romance",2004,80,"Nine years after Jesse and Celine first met, they encounter each other again on the French leg of Jesse's book tour.",Richard Linklater,"Ethan Hawke,Julie Delpy,Vernon Dobtcheff,Louise Lemoine Torrès,Rodolphe Pauly,Mariane Plasteig,Diabolo,Denis Evrard,Albert Delpy,Marie Pillet",R,"United States,France","English,French"
Rush,,8.1,"Action,Biography,Drama",2013,123,The merciless 1970s rivalry between Formula One rivals James Hunt and Niki Lauda.,Ron Howard,"Daniel Brühl,Chris Hemsworth,Olivia Wilde,Alexandra Maria Lara,Pierfrancesco Favino,David Calder,Natalie Dormer,Stephen Mangan,Christian McKay,Alistair Petrie,Julian Rhind-Tutt,Colin Stinton,Jamie de Courcey,Augusto Dallara,Ilario Calvo,Patrick Baladi,Vincent Riotta,Martin Savage",R,"United Kingdom,United States","English,German,Italian,French,Spanish"
Ratatouille,,8.1,"Animation,Adventure,Comedy",2007,111,A rat who can cook makes an unusual alliance with a young kitchen worker at a famous Paris restaurant.,"Brad Bird,Jan Pinkava","Brad Garrett,Lou Romano,Patton Oswalt,Ian Holm,Brian Dennehy,Peter Sohn,Peter O'Toole,Janeane Garofalo,Will Arnett,Julius Callahan,James Remar,John Ratzenberger,Teddy Newton,Tony Fucile,Jake Steinfeld,Brad Bird,Stéphane Roux,Jack Bird",G,United States,"English,French"
Pather Panchali,,8.3,Drama,1955,125,"Impoverished priest Harihar Ray, dreaming of a better life for himself and his family, leaves his rural Bengal village in search of work.",Satyajit Ray,"Kanu Bannerjee,Karuna Bannerjee,Subir Banerjee,Chunibala Devi,Uma Das Gupta,Runki Banerjee,Reba Devi,Aparna Devi,Tulsi Chakraborty,Haren Banerjee,Rampada Das,Nibhanani Devi,Rama Gangopadhaya,Roma Ganguli,Binoy Mukherjee,Haridhan Nag,Harimohan Nag,Kshirod Roy",Not Rated,India,Bengali
Into the Wild,,8.1,"Adventure,Biography,Drama",2007,148,"After graduating from Emory University, top student and athlete Christopher McCandless abandons his possessions, gives his entire $24,000 savings account to charity and hitchhikes to Alaska to live in the wilderness. Along the way, Christopher encounters a series of characters that shape his life.",Sean Penn,"Emile Hirsch,Vince Vaughn,Catherine Keener,Marcia Gay Harden,William Hurt,Jena Malone,Brian H. Dierker,Kristen Stewart,Hal Holbrook,Jim Gallien,James O'Neill,Malinda McCollum,Paul Knauls,Zach Galifianakis,Craig Mutsch,Jim Beidler,John Decker,John Hofer",R,United States,"English,Danish"
Logan,,8.1,"Action,Drama,Sci-Fi",2017,137,"In a future where mutants are nearly extinct, an elderly and weary Logan leads a quiet life. But when Laura, a mutant child pursued by scientists, comes to him for help, he must get her to safety.",James Mangold,"Hugh Jackman,Patrick Stewart,Dafne Keen,Boyd Holbrook,Stephen Merchant,Elizabeth Rodriguez,Richard E. Grant,Eriq La Salle,Elise Neal,Quincy Fouse,Al Coronel,Frank Gallegos,Anthony Escobar,Reynaldo Gallegos,Krzysztof Soszynski,Stephen Dunlevy,Daniel Bernhardt,Ryan Sturz",R,United States,"English,Spanish"
