title,original_title,score,genres,release_year,length_in_minutes,synopsis,directors,actors,public,countries_of_origin,original_languages
Toy Story,,8.3,"Animation,Adventure,Comedy",1995,81,A cowboy doll is profoundly threatened and jealous when a new spaceman action figure supplants him as top toy in a boy's bedroom.,John Lasseter,"Tom Hanks,Tim Allen,Don Rickles,Jim Varney,Wallace Shawn,John Ratzenberger,Annie Potts,John Morris,Erik von Detten,Laurie Metcalf,R. Lee Ermey,Sarah Rayne,Penn Jillette,Jack Angel,Spencer Aste,Greg Berg,Lisa Bradley,Kendall Cunningham",G,United States,English
The Dark Knight Rises,,8.4,"Action,Drama",2012,164,"Eight years after the Joker's reign of anarchy, Batman, with the help of the enigmatic Selina Kyle, is forced from his exile to save Gotham City from the brutal guerrilla terrorist Bane.",Christopher Nolan,"Christian Bale,Tom Hardy,Anne Hathaway,Gary Oldman,Joseph Gordon-Levitt,Marion Cotillard,Morgan Freeman,Michael Caine,Matthew Modine,Alon Aboutboul,Ben Mendelsohn,Burn Gorman,Daniel Sunjata,Aidan Gillen,Sam Kennard,Aliash Tepina,Nestor Carbonell,Brett Cullen",PG-13,"United States,United Kingdom","English,Arabic"
American Beauty,,8.4,Drama,1999,122,A sexually frustrated suburban father has a mid-life crisis after becoming infatuated with his daughter's best friend.,Sam Mendes,"Kevin Spacey,Annette Bening,Thora Birch,Wes Bentley,Mena Suvari,Peter Gallagher,Allison Janney,Chris Cooper,Scott Bakula,Sam Robards,Barry Del Sherman,Ara Celi,John Cho,Fort Atkinson,Sue Casey,Kent Faulcon,Brenda Wehle,Lisa Cloud",R,United States,English
Dr. Strangelove or: How I Learned to Stop Worrying and Love the Bomb,,8.4,"Comedy,War",1964,95,"An insane American general orders a bombing attack on the Soviet Union, triggering a path to nuclear holocaust that a war room full of politicians and generals frantically tries to stop.",Stanley Kubrick,"Peter Sellers,George C. Scott,Sterling Hayden,Keenan Wynn,Slim Pickens,Peter Bull,James Earl Jones,Tracy Reed,Jack Creley,Frank Berry,Robert O'Neil,Glenn Beck,Roy Stephens,Shane Rimmer,Hal Galili,Paul Tamarin,Laurence Herder,Gordon Tanner",PG,"United Kingdom,United States","English,Russian"
Aliens,,8.4,"Action,Adventure,Sci-Fi",1986,137,"Fifty-seven years after surviving an apocalyptic attack aboard her space vessel by merciless space creatures, Officer Ripley awakens from hyper-sleep and tries to warn anyone who will listen about the predators.",James Cameron,"Sigourney Weaver,Michael Biehn,Carrie Henn,Paul Reiser,Lance Henriksen,Bill Paxton,William Hope,Jenette Goldstein,Al Matthews,Mark Rolston,Ricco Ross,Colette Hiller,Daniel Kash,Cynthia Dale Scott,Tip Tipping,Trevor Steedman,Paul Maxwell,Valerie Colgan",R,"United Kingdom,United States","English,Spanish"
Witness for the Prosecution,,8.4,"Crime,Drama,Mystery",1957,116,A veteran British barrister must defend his client in a murder trial that has surprise after surprise.,Billy Wilder,"Tyrone Power,Marlene Dietrich,Charles Laughton,Elsa Lanchester,John Williams,Henry Daniell,Ian Wolfe,Torin Thatcher,Norma Varden,Una O'Connor,Francis Compton,Philip Tonge,Ruta Lee,Patrick Aherne,Don Ames,Walter Bacon,Eddie Baker,Benjie Bancroft",Approved,United States,"English,German"
Spider-Man: Into the Spider-Verse,,8.4,"Animation,Action,Adventure",2018,117,"Teen Miles Morales becomes the Spider-Man of his universe, and must join with five spider-powered individuals from other dimensions to stop a threat for all realities.","Bob Persichetti,Peter Ramsey,Rodney Rothman","Shameik Moore,Jake Johnson,Hailee Steinfeld,Mahershala Ali,Brian Tyree Henry,Lily Tomlin,Luna Lauren Velez,Zoë Kravitz,John Mulaney,Kimiko Glenn,Nicolas Cage,Kathryn Hahn,Liev Schreiber,Chris Pine,Natalie Morales,Edwin R. Habacon,Oscar Isaac,Greta Lee",PG,United States,"English,Spanish"
Avengers: Infinity War,,8.4,"Action,Adventure,Sci-Fi",2018,149,The Avengers and their allies must be willing to sacrifice all in an attempt to defeat the powerful Thanos before his blitz of devastation and ruin puts an end to the universe.,"Anthony Russo,Joe Russo","Robert Downey Jr.,Chris Hemsworth,Mark Ruffalo,Chris Evans,Scarlett Johansson,Don Cheadle,Benedict Cumberbatch,Tom Holland,Chadwick Boseman,Zoe Saldana,Karen Gillan,Tom Hiddleston,Paul Bettany,Elizabeth Olsen,Anthony Mackie,Sebastian Stan,Idris Elba,Danai Gurira",PG-13,United States,English
The Great Dictator,,8.4,"Comedy,Drama,War",1940,125,Dictator Adenoid Hynkel tries to expand his empire while a poor Jewish barber tries to avoid persecution from Hynkel's regime.,Charles Chaplin,"Charles Chaplin,Paulette Goddard,Jack Oakie,Reginald Gardiner,Henry Daniell,Billy Gilbert,Grace Hayle,Carter DeHaven,Maurice Moscovitch,Emma Dunn,Bernard Gorcey,Paul Weigel,Chester Conklin,Esther Michelson,Hank Mann,Florence Wright,Eddie Gribbon,Rudolph Anders",G,United States,"English,Esperanto,Latin"
Sunset Blvd.,,8.4,"Drama,Film-Noir",1950,110,A screenwriter develops a dangerous relationship with a faded film star determined to make a triumphant return.,Billy Wilder,"William Holden,Gloria Swanson,Erich von Stroheim,Nancy Olson,Fred Clark,Lloyd Gough,Jack Webb,Franklyn Farnum,Larry J. Blake,Charles Dayton,Cecil B. DeMille,Hedda Hopper,Buster Keaton,Anna Q. Nilsson,H.B. Warner,Ray Evans,Jay Livingston,Fred Aldrich",Passed,United States,English
The Lives of Others,Das Leben der Anderen,8.4,"Drama,Mystery,Thriller",2006,137,"In 1984 East Berlin, an agent of the secret police, conducting surveillance on a writer and his lover, finds himself becoming increasingly absorbed by their lives.",Florian Henckel von Donnersmarck,"Ulrich Mühe,Martina Gedeck,Sebastian Koch,Ulrich Tukur,Thomas Thieme,Hans-Uwe Bauer,Volkmar Kleinert,Matthias Brenner,Charly Hübner,Herbert Knaup,Bastian Trost,Marie Gruber,Volker Michalowski,Werner Daehn,Martin Brambach,Hubertus Hartmann,Thomas Arnold,Hinnerk Schönemann",R,"Germany,France",German
Paths of Glory,,8.4,"Drama,War",1957,88,"After refusing to attack an enemy position, a general accuses the soldiers of cowardice and their commanding officer must defend them.",Stanley Kubrick,"Kirk Douglas,Ralph Meeker,Adolphe Menjou,George Macready,Wayne Morris,Richard Anderson,Joe Turkel,Christiane Kubrick,Jerry Hausner,Peter Capell,Emile Meyer,Bert Freed,Kem Dibbs,Timothy Carey,Fred Bell,John Stein,Harold Benedict,Leon Briggs",Approved,United States,"English,German,Latin"
The Shining,,8.4,"Drama,Horror",1980,146,"A family heads to an isolated hotel for the winter where a sinister presence influences the father into violence, while his psychic son sees horrific forebodings from both past and future.",Stanley Kubrick,"Jack Nicholson,Shelley Duvall,Danny Lloyd,Scatman Crothers,Barry Nelson,Philip Stone,Joe Turkel,Anne Jackson,Tony Burton,Lia Beldam,Billie Gibson,Barry Dennen,David Baxt,Manning Redwood,Lisa Burns,Louise Burns,Robin Pappas,Alison Coleridge",R,"United Kingdom,United States",English
Django Unchained,,8.4,"Drama,Western",2012,165,"With the help of a German bounty-hunter, a freed slave sets out to rescue his wife from a brutal plantation-owner in Mississippi.",Quentin Tarantino,"Jamie Foxx,Christoph Waltz,Leonardo DiCaprio,Kerry Washington,Samuel L. Jackson,Walton Goggins,Dennis Christopher,James Remar,David Steen,Dana Gourrier,Nichole Galicia,Laura Cayouette,Ato Essandoh,Sammi Rotibi,Clay Donahue Fontenot,Escalante Lundy,Miriam F. Glover,Don Johnson",R,United States,"English,German,French,Italian"
Indiana Jones and the Raiders of the Lost Ark,Raiders of the Lost Ark,8.4,"Action,Adventure",1981,115,"Archaeology professor Indiana Jones ventures to seize a biblical artefact known as the Ark of the Covenant. While doing so, he puts up a fight against Renee and a troop of Nazis.",Steven Spielberg,"Harrison Ford,Karen Allen,Paul Freeman,John Rhys-Davies,Ronald Lacey,Denholm Elliott,Alfred Molina,Wolf Kahler,Anthony Higgins,Vic Tablian,Don Fellows,William Hootkins,Bill Reimbold,Fred Sorenson,Patrick Durkin,Matthew Scurfield,Malcolm Weaver,Sonny Caldinez",PG,United States,"English,German,Hebrew,Spanish,Arabic,Nepali"
WALL·E,,8.4,"Animation,Adventure,Family",2008,98,"In the distant future, a small waste-collecting robot inadvertently embarks on a space journey that will ultimately decide the fate of mankind.",Andrew Stanton,"Ben Burtt,Elissa Knight,Jeff Garlin,Fred Willard,MacInTalk,John Ratzenberger,Kathy Najimy,Sigourney Weaver",G,United States,"English,Hindi"
Memento,,8.4,"Mystery,Thriller",2000,113,A man with short-term memory loss attempts to track down his wife's murderer.,Christopher Nolan,"Guy Pearce,Carrie-Anne Moss,Joe Pantoliano,Mark Boone Junior,Russ Fega,Jorja Fox,Stephen Tobolowsky,Harriet Sansom Harris,Thomas Lennon,Callum Keith Rennie,Kimberly Campbell,Marianne Muellerleile,Larry Holden,Stephanie Searson,Buzz Visconti",R,United States,English
City Lights,,8.5,"Comedy,Drama,Romance",1931,87,"With the aid of a wealthy erratic tippler, a dewy-eyed tramp who has fallen in love with a sightless flower girl accumulates money to be able to help her medically.",Charles Chaplin,"Charles Chaplin,Virginia Cherrill,Florence Lee,Harry Myers,Al Ernest Garcia,Hank Mann,Johnny Aber,Jack Alexander,T.S. Alexander,Victor Alexander,Albert Austin,Harry Ayers,Eddie Baker,Henry Bergman,Edward Biby,Betty Blair,Buster Brodie,Jeanne Carpenter",G,United States,"None,English"
Alien,,8.5,"Horror,Sci-Fi",1979,117,The crew of a commercial spacecraft encounter a deadly lifeform after investigating an unknown transmission.,Ridley Scott,"Sigourney Weaver,Tom Skerritt,John Hurt,Veronica Cartwright,Harry Dean Stanton,Ian Holm,Yaphet Kotto,Bolaji Badejo,Helen Horton,Eddie Powell",R,"United Kingdom,United States",English
Apocalypse Now,,8.5,"Drama,Mystery,War",1979,147,A U.S. Army officer serving in Vietnam is tasked with assassinating a renegade Special Forces Colonel who sees himself as a god.,Francis Ford Coppola,"Martin Sheen,Marlon Brando,Robert Duvall,Frederic Forrest,Sam Bottoms,Laurence Fishburne,Albert Hall,Harrison Ford,Dennis Hopper,G.D. Spradlin,Jerry Ziesmer,Scott Glenn,Bo Byers,James Keane,Kerry Rossall,Ron McQueen,Tom Mason,Cynthia Wood",R,United States,"English,French,Vietnamese"
Cinema Paradiso,Nuovo Cinema Paradiso,8.5,"Drama,Romance",1988,155,A filmmaker recalls his childhood when falling in love with the pictures at the cinema of his home village and forms a deep friendship with the cinema's projectionist.,Giuseppe Tornatore,"Philippe Noiret,Enzo Cannavale,Antonella Attili,Isa Danieli,Leo Gullotta,Marco Leonardi,Pupella Maggio,Agnese Nano,Leopoldo Trieste,Salvatore Cascio,Tano Cimarosa,Nicola Di Pinto,Roberta Lena,Nino Terzo,Jacques Perrin,Nellina Laganà,Turi Giuffrida,Mariella Lo Giudice",PG,"Italy,France",Italian
Once Upon a Time in the West,C'era una volta il West,8.5,Western,1968,165,A mysterious stranger with a harmonica joins forces with a notorious desperado to protect a beautiful widow from a ruthless assassin working for the railroad.,Sergio Leone,"Henry Fonda,Charles Bronson,Claudia Cardinale,Jason Robards,Gabriele Ferzetti,Paolo Stoppa,Woody Strode,Jack Elam,Keenan Wynn,Frank Wolff,Lionel Stander,Livio Andronico,Salvatore Basile,Aldo Berti,Joseph Bradley,Frank Braña,Marilù Carteny,Saturno Cerra",PG-13,"Italy,United States","Italian,English,Spanish"
Rear Window,,8.5,"Mystery,Thriller",1954,112,"A wheelchair-bound photographer spies on his neighbors from his Greenwich Village courtyard apartment window, and becomes convinced one of them has committed murder, despite the skepticism of his fashion-model girlfriend.",Alfred Hitchcock,"James Stewart,Grace Kelly,Wendell Corey,Thelma Ritter,Raymond Burr,Judith Evelyn,Ross Bagdasarian,Georgine Darcy,Sara Berner,Frank Cady,Jesslyn Fax,Rand Harper,Irene Winston,Havis Davenport,Jerry Antes,Barbara Bailey,Benny Bartlett,Nick Borgani",PG,United States,English
The Intouchables,Intouchables,8.5,"Biography,Comedy,Drama",2011,112,"After he becomes a quadriplegic from a paragliding accident, an aristocrat hires a young man from the projects to be his caregiver.","Olivier Nakache,Éric Toledano","François Cluzet,Omar Sy,Anne Le Ny,Audrey Fleurot,Joséphine de Meaux,Clotilde Mollet,Alba Gaïa Bellugi,Cyril Mendy,Salimata Kamate,Absa Diatou Toure,Grégoire Oestermann,Dominique Daguier,François Caron,Christian Ameri,Thomas Solivérès,Dorothée Brière,Marie-Laure Descoureaux,Émilie Caen",R,France,"French,English"
Modern Times,,8.5,"Comedy,Drama,Romance",1936,87,The Tramp struggles to live in modern industrial society with the help of a young homeless woman.,Charles Chaplin,"Charles Chaplin,Paulette Goddard,Henry Bergman,Tiny Sandford,Chester Conklin,Hank Mann,Stanley Blystone,Al Ernest Garcia,Richard Alexander,Cecil Reynolds,Mira McKinney,Murdock MacQuarrie,Wilfred Lucas,Edward LeSaint,Fred Malatesta,Sammy Stein,Juana Sutton,Ted Oliver",G,United States,English
Grave of the Fireflies,Hotaru no haka,8.5,"Animation,Drama,War",1988,89,A young boy and his little sister struggle to survive in Japan during World War II.,Isao Takahata,"Tsutomu Tatsumi,Ayano Shiraishi,Akemi Yamaguchi,Yoshiko Shinohara,Kôzô Hashida,Masayo Sakai,Kazumi Nozaki,Yoshio Matsuoka,Masahiro Kanetake,Kiyoshi Yanagawa,Hajime Maki,Atsuo Omote,Teruhisa Harita,Hiroshi Tanaka,Michio Denpô,Shirô Tamaki,Tadashi Nakamura,Mika Sekita",Not Rated,Japan,Japanese
Casablanca,,8.5,"Drama,Romance,War",1942,102,A cynical expatriate American cafe owner struggles to decide whether or not to help his former lover and her fugitive husband escape the Nazis in French Morocco.,Michael Curtiz,"Humphrey Bogart,Ingrid Bergman,Paul Henreid,Claude Rains,Conrad Veidt,Sydney Greenstreet,Peter Lorre,S.Z. Sakall,Madeleine Lebeau,Dooley Wilson,Joy Page,John Qualen,Leonid Kinskey,Curt Bois,Abdullah Abbas,Enrique Acosta,Ed Agresti,Arnet Amos",PG,United States,"English,French,German,Italian"
Harakiri,Seppuku,8.6,"Action,Drama,Mystery",1962,133,"When a ronin requesting seppuku at a feudal lord's palace is told of the brutal suicide of another ronin who previously visited, he reveals how their pasts are intertwined - and in doing so challenges the clan's integrity.",Masaki Kobayashi,"Tatsuya Nakadai,Akira Ishihama,Shima Iwashita,Tetsurô Tanba,Masao Mishima,Ichirô Nakatani,Kei Satô,Yoshio Inaba,Hisashi Igawa,Tôru Takeuchi,Yoshirô Aoki,Tatsuo Matsumura,Akiji Kobayashi,Kôichi Hayashi,Ryûtarô Gomi,Jô Azumi,Nakajirô Tomita,Shichisaburô Amatsu",Not Rated,Japan,Japanese
Whiplash,,8.5,"Drama,Music",2014,106,A promising young drummer enrolls at a cut-throat music conservatory where his dreams of greatness are mentored by an instructor who will stop at nothing to realize a student's potential.,Damien Chazelle,"Miles Teller,J.K. Simmons,Melissa Benoist,Paul Reiser,Austin Stowell,Nate Lang,Chris Mulkey,Damon Gupton,Suanne Spoke,Max Kasch,Charlie Ian,Jayson Blair,Kofi Siriboe,Kavita Patil,C.J. Vana,Tarik Lowe,Tyler Kimball,Rogelio Douglas Jr.",R,United States,English
American History X,,8.5,"Crime,Drama",1998,119,A former neo-nazi skinhead tries to prevent his younger brother from going down the same wrong path that he did.,Tony Kaye,"Edward Norton,Edward Furlong,Beverly D'Angelo,Jennifer Lien,Ethan Suplee,Fairuza Balk,Avery Brooks,Elliott Gould,Stacy Keach,William Russ,Guy Torry,Joe Cortese,Jason Bose Smith,Antonio David Lyons,Alex Sol,Keram Malicki-Sánchez,Giuseppe Andrews,Michelle Christine White",R,United States,English
The Usual Suspects,,8.5,"Crime,Drama,Mystery",1995,106,"A sole survivor tells of the twisty events leading up to a horrific gun battle on a boat, which began when five criminals met at a seemingly random police lineup.",Bryan Singer,"Kevin Spacey,Gabriel Byrne,Chazz Palminteri,Stephen Baldwin,Benicio Del Toro,Kevin Pollak,Pete Postlethwaite,Suzy Amis,Giancarlo Esposito,Dan Hedaya,Paul Bartel,Carl Bressler,Phillipe Simon,Jack Shearer,Christine Estabrook,Clark Gregg,Morgan Hunter,Ken Daly",R,"United States,Germany","English,Hungarian,Spanish,French"
The Prestige,,8.5,"Drama,Mystery,Sci-Fi",2006,130,"After a tragic accident, two stage magicians in 1890s London engage in a battle to create the ultimate illusion while sacrificing everything they have to outwit each other.",Christopher Nolan,"Christian Bale,Hugh Jackman,Scarlett Johansson,Michael Caine,Piper Perabo,Rebecca Hall,Samantha Mahurin,David Bowie,Andy Serkis,Daniel Davis,Jim Piddock,Christopher Neame,Mark Ryan,Roger Rees,Jamie Harris,Monty Stuart,Ron Perkins,Ricky Jay",PG-13,"United Kingdom,United States",English
The Lion King,,8.5,"Animation,Adventure,Drama",1994,88,"Lion prince Simba and his father are targeted by his bitter uncle, who wants to ascend the throne himself.","Roger Allers,Rob Minkoff","Matthew Broderick,Jeremy Irons,James Earl Jones,Whoopi Goldberg,Rowan Atkinson,Niketa Calame-Harris,Jim Cummings,Robert Guillaume,Moira Kelly,Nathan Lane,Zoe Leader,Cheech Marin,Ernie Sabella,Madge Sinclair,Jonathan Taylor Thomas,Frank Welker,Cathy Cavadini,Judi M. Durand",G,United States,"English,Swahili,Xhosa,Zulu"
Gladiator,,8.5,"Action,Adventure,Drama",2000,155,A former Roman General sets out to exact vengeance against the corrupt emperor who murdered his family and sent him into slavery.,Ridley Scott,"Russell Crowe,Joaquin Phoenix,Connie Nielsen,Oliver Reed,Richard Harris,Derek Jacobi,Djimon Hounsou,David Schofield,John Shrapnel,Tomas Arana,Ralf Moeller,Spencer Treat Clark,David Hemmings,Tommy Flanagan,Sven-Ole Thorsen,Omid Djalili,Nicholas McGaughey,Chris Kell",R,"United States,United Kingdom,Malta,Morocco",English
Léon: The Professional,Léon,8.5,"Action,Crime,Drama",1994,110,"12-year-old Mathilda is reluctantly taken in by Léon, a professional assassin, after her family is murdered. An unusual relationship forms as she becomes his protégée and learns the assassin's trade.",Luc Besson,"Jean Reno,Gary Oldman,Natalie Portman,Danny Aiello,Peter Appel,Willi One Blood,Don Creech,Keith A. Glascoe,Randolph Scott,Michael Badalucco,Ellen Greene,Elizabeth Regen,Carl J. Matusovich,Frank Senger,Lucius Wyatt Cherokee,Eric Challier,Luc Bernard,Maïwenn",R,"France,United States","English,Italian,French"
The Departed,,8.5,"Crime,Drama,Thriller",2006,151,An undercover cop and a mole in the police attempt to identify each other while infiltrating an Irish gang in South Boston.,Martin Scorsese,"Leonardo DiCaprio,Matt Damon,Jack Nicholson,Mark Wahlberg,Martin Sheen,Ray Winstone,Vera Farmiga,Anthony Anderson,Alec Baldwin,Kevin Corrigan,James Badge Dale,David O'Hara,Mark Rolston,Robert Wahlberg,Kristen Dalton,Thomas B. Duffy,Richard Hughes,J.C. MacKenzie",R,"United States,Hong Kong","English,Cantonese"
One Flew Over the Cuckoo's Nest,,8.7,Drama,1975,133,"In the Fall of 1963, a Korean War veteran and criminal pleads insanity and is admitted to a mental institution, where he rallies up the scared patients against the tyrannical nurse.",Milos Forman,"Jack Nicholson,Louise Fletcher,Michael Berryman,Peter Brocco,Dean R. Brooks,Alonzo Brown,Scatman Crothers,Mwako Cumbuka,Danny DeVito,William Duell,Josip Elic,Lan Fendors,Nathan George,Ken Kenny,Mel Lambert,Sydney Lassick,Kay Lee,Christopher Lloyd",R,United States,English
Parasite,Gisaengchung,8.5,"Drama,Thriller",2019,132,Greed and class discrimination threaten the newly formed symbiotic relationship between the wealthy Park family and the destitute Kim clan.,Bong Joon Ho,"Song Kang-ho,Lee Sun-kyun,Cho Yeo-jeong,Choi Woo-sik,Park So-dam,Lee Jeong-eun,Jang Hye-jin,Park Myeong-hoon,Jung Ji-so,Jung Hyun-jun,Park Keun-rok,Jung Yi-seo,Jo Jae-myeong,Jung Ik-han,Kim Kyu-baek,Hwang In-kyung,Ahn Seong-bong,Kim Jin-hyung",R,South Korea,"Korean,English"
Goodfellas,,8.7,"Biography,Crime,Drama",1990,145,"The story of Henry Hill and his life in the mob, covering his relationship with his wife Karen Hill and his mob partners Jimmy Conway and Tommy DeVito in the Italian-American crime syndicate.",Martin Scorsese,"Robert De Niro,Ray Liotta,Joe Pesci,Lorraine Bracco,Paul Sorvino,Frank Sivero,Tony Darrow,Mike Starr,Frank Vincent,Chuck Low,Frank DiLeo,Henny Youngman,Gina Mastrogiacomo,Catherine Scorsese,Charles Scorsese,Suzanne Shepherd,Debi Mazar,Margo Winkler",R,United States,"English,Italian"
Star Wars: Episode V - The Empire Strikes Back,The Empire Strikes Back,8.7,"Action,Adventure,Fantasy",1980,124,"After the Rebels are brutally overpowered by the Empire on the ice planet Hoth, Luke Skywalker begins Jedi training with Yoda, while his friends are pursued across the galaxy by Darth Vader and bounty hunter Boba Fett.",Irvin Kershner,"Mark Hamill,Harrison Ford,Carrie Fisher,Billy Dee Williams,Anthony Daniels,David Prowse,Peter Mayhew,Kenny Baker,Frank Oz,Alec Guinness,Jeremy Bulloch,John Hollis,Jack Purvis,Des Webb,Clive Revill,Kenneth Colley,Julian Glover,Michael Sheard",PG,United States,English
The Lord of the Rings: The Two Towers,,8.8,"Action,Adventure,Drama",2002,179,"While Frodo and Sam edge closer to Mordor with the help of the shifty Gollum, the divided fellowship makes a stand against Sauron's new ally, Saruman, and his hordes of Isengard.",Peter Jackson,"Elijah Wood,Ian McKellen,Viggo Mortensen,Orlando Bloom,Bruce Allpress,Sean Astin,John Bach,Sala Baker,Cate Blanchett,Billy Boyd,Jed Brophy,Sam Comery,Brad Dourif,Calum Gittins,Bernard Hill,Bruce Hopkins,Paris Howe Strewe,Christopher Lee",PG-13,"New Zealand,United States","English,Sindarin,Old English"
The Matrix,,8.7,"Action,Sci-Fi",1999,136,"When a beautiful stranger leads computer hacker Neo to a forbidding underworld, he discovers the shocking truth--the life he knows is the elaborate deception of an evil cyber-intelligence.","Lana Wachowski,Lilly Wachowski","Keanu Reeves,Laurence Fishburne,Carrie-Anne Moss,Hugo Weaving,Gloria Foster,Joe Pantoliano,Marcus Chong,Julian Arahanga,Matt Doran,Belinda McClory,Anthony Ray Parker,Paul Goddard,Robert Taylor,David Aston,Marc Aden Gray,Ada Nicodemou,Deni Gordon,Rowan Witt",R,"United States,Australia",English
Inception,,8.8,"Action,Adventure,Sci-Fi",2010,148,"A thief who steals corporate secrets through the use of dream-sharing technology is given the inverse task of planting an idea into the mind of a C.E.O., but his tragic past may doom the project and his team to disaster.",Christopher Nolan,"Leonardo DiCaprio,Joseph Gordon-Levitt,Elliot Page,Ken Watanabe,Tom Hardy,Dileep Rao,Cillian Murphy,Tom Berenger,Marion Cotillard,Pete Postlethwaite,Michael Caine,Lukas Haas,Tai-Li Lee,Claire Geare,Magnus Nolan,Taylor Geare,Johnathan Geare,Tohoru Masamune",PG-13,"United States,United Kingdom","English,Japanese,French"
Fight Club,,8.8,Drama,1999,139,An insomniac office worker and a devil-may-care soap maker form an underground fight club that evolves into much more.,David Fincher,"Brad Pitt,Edward Norton,Meat Loaf,Zach Grenier,Richmond Arquette,David Andrews,George Maguire,Eugenie Bondurant,Christina Cabot,Helena Bonham Carter,Sydney 'Big Dawg' Colston,Rachel Singer,Christie Cronenweth,Tim DeZarn,Ezra Buzzington,Dierdre Downing-Jackson,Bob Stephenson,Charlie Dell",R,"Germany,United States",English
Schindler's List,,9.0,"Biography,Drama,History",1993,195,"In German-occupied Poland during World War II, industrialist Oskar Schindler gradually becomes concerned for his Jewish workforce after witnessing their persecution by the Nazis.",Steven Spielberg,"Liam Neeson,Ralph Fiennes,Ben Kingsley,Caroline Goodall,Jonathan Sagall,Embeth Davidtz,Malgorzata Gebel,Shmuel Levy,Mark Ivanir,Béatrice Macola,Andrzej Seweryn,Friedrich von Thun,Krzysztof Luft,Harry Nehring,Norbert Weisser,Adi Nitzan,Michael Schneider,Miri Fabian",R,United States,"English,Hebrew,German,Polish,Latin"
The Lord of the Rings: The Fellowship of the Ring,,8.8,"Action,Adventure,Drama",2001,178,A meek Hobbit from the Shire and eight companions set out on a journey to destroy the powerful One Ring and save Middle-earth from the Dark Lord Sauron.,Peter Jackson,"Elijah Wood,Ian McKellen,Orlando Bloom,Sean Bean,Alan Howard,Noel Appleby,Sean Astin,Sala Baker,Billy Boyd,Andy Serkis,Marton Csokas,Viggo Mortensen,Megan Edwards,Michael Elsworth,Cate Blanchett,Mark Ferguson,Ian Holm,Christopher Lee",PG-13,"New Zealand,United States","English,Sindarin"
The Lord of the Rings: The Return of the King,,9.0,"Action,Adventure,Drama",2003,201,Gandalf and Aragorn lead the World of Men against Sauron's army to draw his gaze from Frodo and Sam as they approach Mount Doom with the One Ring.,Peter Jackson,"Elijah Wood,Viggo Mortensen,Ian McKellen,Orlando Bloom,Noel Appleby,Ali Astin,Sean Astin,David Aston,John Bach,Sean Bean,Cate Blanchett,Billy Boyd,Sadwyn Brophy,Alistair Browning,Marton Csokas,Richard Edge,Jason Fitch,Bernard Hill",PG-13,"New Zealand,United States","English,Quenya,Old English,Sindarin"
"The Good, the Bad and the Ugly","Il buono, il brutto, il cattivo",8.8,"Adventure,Western",1966,178,A bounty hunting scam joins two men in an uneasy alliance against a third in a race to find a fortune in gold buried in a remote cemetery.,Sergio Leone,"Clint Eastwood,Eli Wallach,Lee Van Cleef,Aldo Giuffrè,Luigi Pistilli,Rada Rassimov,Enzo Petito,Claudio Scarchilli,John Bartha,Livio Lorenzon,Antonio Casale,Sandro Scarchilli,Benito Stefanelli,Angelo Novi,Antonio Casas,Aldo Sambrell,Al Mulock,Sergio Mendizábal",R,"Italy,Spain,West Germany","Italian,English"
Forrest Gump,,8.8,"Drama,Romance",1994,142,"The presidencies of Kennedy and Johnson, the Vietnam War, the Watergate scandal and other historical events unfold from the perspective of an Alabama man with an IQ of 75, whose only desire is to be reunited with his childhood sweetheart.",Robert Zemeckis,"Tom Hanks,Robin Wright,Gary Sinise,Sally Field,Rebecca Williams,Michael Conner Humphreys,Harold G. Herthum,George Kelly,Bob Penny,John Randall,Sam Anderson,Margo Moorer,Ione M. Telech,Christine Seabrook,John Worsham,Peter Dobson,Siobhan Fallon Hogan,Alexander Zemeckis",PG-13,United States,English
