title,original_title,score,genres,release_year,length_in_minutes,synopsis,directors,actors,public,countries_of_origin,original_languages
The Terminator,,8.1,"Action,Sci-Fi",1984,107,"A human soldier is sent from 2029 to 1984 to stop an almost indestructible cyborg killing machine, sent from the same year, which has been programmed to execute a young woman whose unborn son is the key to humanity's future salvation.",James Cameron,"Arnold Schwarzenegger,Linda Hamilton,Michael Biehn,Paul Winfield,Lance Henriksen,Rick Rossovich,Bess Motta,Earl Boen,Dick Miller,Shawn Schepps,Bruce M. Kerner,Franco Columbu,Bill Paxton,Brad Rearden,Brian Thompson,William Wisher,Ken Fritz,Tom Oberhaus",R,"United Kingdom,United States","English,Spanish"
Stand by Me,,8.1,"Adventure,Drama",1986,89,"After the death of one of his friends, a writer recounts a childhood journey with his friends to find the body of a missing boy.",Rob Reiner,"Wil Wheaton,River Phoenix,Corey Feldman,Jerry O'Connell,Kiefer Sutherland,Casey Siemaszko,Gary Riley,Bradley Gregg,Jason Oliver Lipsett,Marshall Bell,Frances Lee McCain,Bruce Kirby,William Bronder,Scott Beach,Richard Dreyfuss,John Cusack,Madeleine Swift,Popeye",R,United States,English
Spotlight,,8.1,"Biography,Crime,Drama",2015,129,"The true story of how the Boston Globe uncovered the massive scandal of child molestation and cover-up within the local Catholic Archdiocese, shaking the entire Catholic Church to its core.",Tom McCarthy,"Mark Ruffalo,Michael Keaton,Rachel McAdams,Liev Schreiber,John Slattery,Brian d'Arcy James,Stanley Tucci,Elena Wohl,Gene Amoroso,Doug Murray,Sharon McFarlane,Jamey Sheridan,Neal Huff,Billy Crudup,Robert B. Kennedy,Duane Murray,Brian Chamberlain,Michael Cyril Creighton",R,United States,English
Ford v Ferrari,,8.1,"Action,Biography,Drama",2019,152,American car designer Carroll Shelby and driver Ken Miles battle corporate interference and the laws of physics to build a revolutionary race car for Ford in order to defeat Ferrari at the 24 Hours of Le Mans in 1966.,James Mangold,"Matt Damon,Christian Bale,Jon Bernthal,Caitríona Balfe,Josh Lucas,Noah Jupe,Tracy Letts,Remo Girone,Ray McKinnon,JJ Feild,Jack McMullen,Corrado Invernizzi,Joe Williamson,Ian Harding,Christopher Darga,Shawn Law,Emil Beheshti,Darrin Prescott",PG-13,United States,"English,Italian,French,Japanese"
Hotel Rwanda,,8.1,"Biography,Drama,History",2004,121,"Paul Rusesabagina, a hotel manager, houses over a thousand Tutsi refugees during their struggle against the Hutu militia in Rwanda, Africa.",Terry George,"Don Cheadle,Sophie Okonedo,Joaquin Phoenix,Xolani Mali,Desmond Dube,Hakeem Kae-Kazim,Tony Kgoroge,Rosie Motene,Neil McCarthy,Mabutho 'Kid' Sithole,Nick Nolte,Fana Mokoena,Jeremiah Ndlovu,Lebo Mashile,Antonio David Lyons,Leleti Khumalo,Kgomotso Seitshohlo,Lerato Mokgotho",PG-13,"United Kingdom,South Africa,Italy,United States","English,French,Kinyarwanda"
Platoon,,8.1,"Drama,War",1986,120,"Chris Taylor, a neophyte recruit in Vietnam, finds himself caught in a battle of wills between two sergeants, one good and the other evil. A shrewd examination of the brutality of war and the duality of man in conflict.",Oliver Stone,"Charlie Sheen,Tom Berenger,Willem Dafoe,Keith David,Forest Whitaker,Francesco Quinn,Kevin Dillon,John C. McGinley,Reggie Johnson,Mark Moses,Corey Glover,Johnny Depp,Chris Pedersen,Bob Orwig,Corkey Ford,David Neidorf,Richard Edson,Tony Todd",R,"United States,United Kingdom","English,Vietnamese"
Rocky,,8.1,"Drama,Sport",1976,120,A small-time Philadelphia boxer gets a supremely rare chance to fight the world heavyweight champion in a bout in which he strives to go the distance for his self-respect.,John G. Avildsen,"Sylvester Stallone,Talia Shire,Burt Young,Carl Weathers,Burgess Meredith,Thayer David,Joe Spinell,Jimmy Gambina,Bill Baldwin,Al Silvani,George Memmoli,Jodi Letizia,Diana Lewis,George O'Hanlon,Larry Carroll,Stan Shaw,Don Sherman,Billy Sands",PG,United States,English
Tokyo Story,Tôkyô monogatari,8.2,Drama,1953,136,"An old couple visit their children and grandchildren in the city, but receive little attention.",Yasujirô Ozu,"Chishû Ryû,Chieko Higashiyama,Sô Yamamura,Setsuko Hara,Haruko Sugimura,Kuniko Miyake,Kyôko Kagawa,Eijirô Tôno,Nobuo Nakamura,Shirô Ôsaka,Hisao Toake,Teruko Nagaoka,Mutsuko Sakura,Toyo Takahashi,Tôru Abe,Sachiko Mitani,Zen Murase,Mitsuhiro Môri",Not Rated,Japan,"Japanese,English"
Dead Poets Society,,8.1,"Comedy,Drama",1989,128,Maverick teacher John Keating uses poetry to embolden his boarding school students to new heights of self-expression.,Peter Weir,"Robin Williams,Robert Sean Leonard,Ethan Hawke,Josh Charles,Gale Hansen,Dylan Kussman,Allelon Ruggiero,James Waterston,Norman Lloyd,Kurtwood Smith,Carla Belver,Leon Pownall,George Martin,Joe Aufiery,Matt Carey,Kevin Cooney,Jane Moore,Lara Flynn Boyle",PG,United States,"English,Latin"
The Passion of Joan of Arc,La passion de Jeanne d'Arc,8.2,"Biography,Drama,History",1928,114,"In 1431, Jeanne d'Arc is placed on trial on charges of heresy. The ecclesiastical jurists attempt to force Jeanne to recant her claims of holy visions.",Carl Theodor Dreyer,"Maria Falconetti,Eugene Silvain,André Berley,Maurice Schutz,Antonin Artaud,Michel Simon,Jean d'Yd,Louis Ravet,Armand Lurville,Jacques Arnna,Alexandre Mihalesco,Léon Larive,Jean Aymé,Camille Bardou,Gilbert Dacheux,Gilbert Dalleu,Paul Delauzac,Dimitri Dimitriev",Passed,France,"None,French"
The Big Lebowski,,8.1,"Comedy,Crime",1998,117,"Ultimate L.A. slacker Jeff ""The Dude"" Lebowski, mistaken for a millionaire of the same name, seeks restitution for a rug ruined by debt collectors, enlisting his bowling buddies for help while trying to find the millionaire's missing wife.","Joel Coen,Ethan Coen","Jeff Bridges,John Goodman,Julianne Moore,Steve Buscemi,David Huddleston,Philip Seymour Hoffman,Tara Reid,Philip Moon,Mark Pellegrino,Peter Stormare,Flea,Torsten Voges,Jimmie Dale Gilmore,Jack Kehler,John Turturro,James G. Hoosier,Carlos Leon,Terrence Burton",R,"United States,United Kingdom","English,German,Hebrew,Spanish"
Jaws,,8.1,"Adventure,Thriller",1975,124,"When a killer shark unleashes chaos on a beach community off Cape Cod, it's up to a local sheriff, a marine biologist, and an old seafarer to hunt the beast down.",Steven Spielberg,"Roy Scheider,Robert Shaw,Richard Dreyfuss,Lorraine Gary,Murray Hamilton,Carl Gottlieb,Jeffrey Kramer,Susan Backlinie,Jonathan Filley,Ted Grossman,Chris Rebello,Jay Mello,Lee Fierro,Jeffrey Voorhees,Craig Kingsbury,Robert Nevin,Peter Benchley,Jonathan Searle",PG,United States,English
"Monsters, Inc.",,8.1,"Animation,Adventure,Comedy",2001,92,"In order to power the city, monsters have to scare children so that they scream. However, the children are toxic to the monsters, and after a child gets through, two monsters realize things may not be what they think.","Pete Docter,David Silverman,Lee Unkrich","Billy Crystal,John Goodman,Mary Gibbs,Steve Buscemi,James Coburn,Jennifer Tilly,Bob Peterson,John Ratzenberger,Frank Oz,Daniel Gerson,Steve Susskind,Bonnie Hunt,Jeff Pidgeon,Samuel Lord Black,Jack Angel,Bob Bergen,Rodger Bumpass,Gino Conforti",G,United States,English
Mary and Max,Mary and Max.,8.1,"Animation,Comedy,Drama",2009,92,"A tale of friendship between two unlikely pen pals: Mary, a lonely, eight-year-old girl living in the suburbs of Melbourne, and Max, a forty-four-year old, severely obese man living in New York.",Adam Elliot,"Toni Collette,Philip Seymour Hoffman,Eric Bana,Barry Humphries,Christopher Massey,Oliver Marks,Daisy Kocher,Daniel Marks,Hamish Hughes,Dan Doherty,Julie Forsyth,Mandy Mao,Patrick McCabe,Adam Elliot,Mr. Peck,Michael James Allen,Bill Murphy,Shaun Patten",Not Rated,Australia,"English,Yiddish"
How to Train Your Dragon,,8.1,"Animation,Action,Adventure",2010,98,"A hapless young Viking who aspires to hunt dragons becomes the unlikely friend of a young dragon himself, and learns there may be more to the creatures than he assumed.","Dean DeBlois,Chris Sanders","Jay Baruchel,Gerard Butler,Christopher Mintz-Plasse,Craig Ferguson,America Ferrera,Jonah Hill,T.J. Miller,Kristen Wiig,Robin Atkin Downes,Philip McGrade,Kieron Elliott,Ashley Jensen,David Tennant,Thom Adcox-Hernandez,Tony Anselmo,Bob Bouchard,Nicholas Guest,Kelly Nigh",PG,United States,English
Room,,8.1,"Drama,Thriller",2015,118,"Held captive for 7 years in an enclosed space, a woman and her young son finally gain their freedom, allowing the boy to experience the outside world for the first time.",Lenny Abrahamson,"Brie Larson,Jacob Tremblay,Sean Bridgers,Wendy Crewson,Sandy McMaster,Matt Gordon,Amanda Brugel,Joe Pingue,Joan Allen,Zarrin Darnell-Martin,Cas Anvar,William H. Macy,Jee-Yun Lee,Randal Edwards,Justin Mader,Ola Sturik,Rodrigo Fernandez-Stoll,Rory O'Shea",R,"Ireland,Canada,United Kingdom,United States",English
The Seventh Seal,Det sjunde inseglet,8.1,"Drama,Fantasy",1957,96,"A knight returning to Sweden after the Crusades seeks answers about life, death, and the existence of God as he plays chess against the Grim Reaper during the Black Plague.",Ingmar Bergman,"Max von Sydow,Gunnar Björnstrand,Bengt Ekerot,Nils Poppe,Bibi Andersson,Inga Gill,Maud Hansson,Inga Landgré,Gunnel Lindblom,Bertil Anderberg,Anders Ek,Åke Fridell,Gunnar Olsson,Erik Strandmark,Siv Aleros,Sten Ardenstam,Harry Asklund,Benkt-Åke Benktsson",Not Rated,Sweden,"Swedish,Latin"
Mad Max: Fury Road,,8.1,"Action,Adventure,Sci-Fi",2015,120,"In a post-apocalyptic wasteland, a woman rebels against a tyrannical ruler in search for her homeland with the aid of a group of female prisoners, a psychotic worshiper, and a drifter named Max.",George Miller,"Tom Hardy,Charlize Theron,Nicholas Hoult,Zoë Kravitz,Hugh Keays-Byrne,Josh Helman,Nathan Jones,Rosie Huntington-Whiteley,Riley Keough,Abbey Lee,Courtney Eaton,John Howard,Richard Carter,Iota,Angus Sampson,Jennifer Hagan,Megan Gale,Melissa Jaffer",R,Australia,"English,Russian"
Mr. Smith Goes to Washington,,8.1,"Comedy,Drama",1939,129,"A naive youth leader is appointed to fill a vacancy in the U.S. Senate. His idealistic plans promptly collide with corruption at home and subterfuge from his hero in Washington, but he tries to forge ahead despite attacks on his character.",Frank Capra,"James Stewart,Jean Arthur,Claude Rains,Edward Arnold,Guy Kibbee,Thomas Mitchell,Eugene Pallette,Beulah Bondi,H.B. Warner,Harry Carey,Astrid Allwyn,Ruth Donnelly,Grant Mitchell,Porter Hall,H.V. Kaltenborn,Charles Lane,Pierre Watkin,Dick Elliott",Passed,United States,English
Wild Tales,Relatos salvajes,8.1,"Comedy,Drama,Thriller",2014,122,Six short stories that explore the extremities of human behavior involving people in distress.,Damián Szifron,"Darío Grandinetti,María Marull,Mónica Villa,Diego Starosta,Marcelo Frasca,Lucila Mangone,María Laura Caccamo,Carlos Alberto Vavassori,Pablo Machado,Horacio Vay,Javier Pedersoli,Héctor Drachtman,María Rosa López Ottonello,Rita Cortese,Julieta Zylberberg,César Bordón,Juan Santiago Linari,Leonardo Sbaraglia",R,"Argentina,Spain,France,United Kingdom",Spanish
Memories of Murder,Salinui chueok,8.1,"Crime,Drama,Mystery",2003,132,"In a small Korean province in 1986, two detectives struggle with the case of multiple young women being found raped and murdered by an unknown culprit.",Bong Joon Ho,"Song Kang-ho,Kim Sang-kyung,Roe-ha Kim,Jae-ho Song,Byun Hee-Bong,Seo-hie Ko,Tae-ho Ryu,No-shik Park,Park Hae-il,Mi-seon Jeon,Young-hwa Seo,Woo Go-na,Ok-joo Lee,Jong-ryol Choi,Seung-mok Yoo,Hun-Kyung Lee,Shin Hyun-jong,Jae-eung Lee",Not Rated,South Korea,"Korean,English"
The Wages of Fear,Le salaire de la peur,8.2,"Adventure,Drama,Thriller",1953,131,"In a decrepit South American village, four men are hired to transport an urgent nitroglycerine shipment without the equipment that would make it safe.",Henri-Georges Clouzot,"Yves Montand,Charles Vanel,Peter van Eyck,Folco Lulli,Véra Clouzot,William Tubbs,Darío Moreno,Jo Dest,Antonio Centa,Luis De Lima,Grégoire Gromoff,Josep Palau i Fabre,Faustini,Seguna,Darling Légitimus,René Baranger,Pat Hurst,Evelio Larenagas",Not Rated,"France,Italy","French,English,Spanish,German,Italian,Russian"
Klaus,,8.1,"Animation,Adventure,Comedy",2019,96,"A simple act of kindness always sparks another, even in a frozen, faraway place. When Smeerensburg's new postman, Jesper, befriends toymaker Klaus, their gifts melt an age-old feud and deliver a sleigh full of holiday traditions.","Sergio Pablos,Carlos Martínez López","Jason Schwartzman,J.K. Simmons,Rashida Jones,Will Sasso,Neda Margrethe Labba,Sergio Pablos,Norm MacDonald,Joan Cusack,Evan Agos,Sky Alexis,Jaeden Bettencourt,Teddy Blum,Mila Brener,Sydney Brower,Finn Carr,Kendall Joy Hall,Hailey Hermida,Lexie Holland",PG,"Spain,United Kingdom,United States","English,Saami"
In the Name of the Father,,8.1,"Biography,Crime,Drama",1993,133,A man's coerced confession to an I.R.A. bombing he did not commit results in the imprisonment of his father as well. An English lawyer fights to free them.,Jim Sheridan,"Daniel Day-Lewis,Pete Postlethwaite,Alison Crosbie,Philip King,Emma Thompson,Nye Heron,Anthony Brophy,Frankie McCafferty,Paul Warriner,Julian Walsh,Stuart Wolfenden,Jo Connor,Karen Carlisle,Seamus Moran,Billy Byrne,Maureen McBride,Jane Nolan,Laurence Griffin",R,"Ireland,United Kingdom",English
Barry Lyndon,,8.1,"Adventure,Drama,War",1975,185,An Irish rogue wins the heart of a rich widow and assumes her dead husband's aristocratic position in 18th-century England.,Stanley Kubrick,"Ryan O'Neal,Marisa Berenson,Patrick Magee,Hardy Krüger,Steven Berkoff,Gay Hamilton,Marie Kean,Diana Körner,Murray Melvin,Frank Middlemass,André Morell,Arthur O'Sullivan,Godfrey Quigley,Leonard Rossiter,Philip Stone,Leon Vitali,John Bindon,Roger Booth",PG,"United Kingdom,United States","English,German,French"
Hacksaw Ridge,,8.1,"Biography,Drama,History",2016,139,"World War II American Army Medic Desmond T. Doss, who served during the Battle of Okinawa, refuses to kill people and becomes the first man in American history to receive the Medal of Honor without firing a shot.",Mel Gibson,"Andrew Garfield,Sam Worthington,Luke Bracey,Teresa Palmer,Richard Pyros,Jacob Warner,Milo Gibson,Darcy Bryce,Roman Guerriero,James Lugton,Kasia Stelmach,Hugo Weaving,Rachel Griffiths,Jarin Towney,Tim McGarry,Tyler Coppin,Richard Platt,Nathaniel Buzolic",R,"Australia,United States,United Kingdom,China","English,Japanese"
Sherlock Jr.,,8.2,"Action,Comedy,Romance",1924,45,"A film projectionist longs to be a detective, and puts his meagre skills to work when he is framed by a rival for stealing his girlfriend's father's pocketwatch.",Buster Keaton,"Buster Keaton,Kathryn McGuire,Joe Keaton,Erwin Connelly,Ward Crane,Jane Connelly,George Davis,Doris Deane,Christine Francis,Betsy Ann Hisle,Kewpie Morgan,Steve Murphy,John Patrick,Ford West",Passed,United States,"English,None"
The Deer Hunter,,8.1,"Drama,War",1978,183,An in-depth examination of the ways in which the Vietnam War impacts and disrupts the lives of several friends in a small steel mill town in Pennsylvania.,Michael Cimino,"Robert De Niro,Christopher Walken,John Cazale,John Savage,Meryl Streep,George Dzundza,Chuck Aspegren,Shirley Stoler,Rutanya Alda,Pierre Segui,Mady Kaplan,Amy Wright,Mary Ann Haenel,Richard Kuss,Joe Grifasi,Christopher Colombi Jr.,Victoria Karnafel,Jack Scardino",R,"United States,United Kingdom","English,Vietnamese,French,Russian,Cantonese"
The General,,8.2,"Action,Adventure,Comedy",1926,67,"After being rejected by the Confederate military, not realizing it was due to his crucial civilian role, an engineer must single-handedly recapture his beloved locomotive after it is seized by Union spies and return it through enemy lines.","Clyde Bruckman,Buster Keaton","Buster Keaton,Marion Mack,Glen Cavender,Jim Farley,Frederick Vroom,Frank Barnes,Charles Henry Smith,Joe Keaton,Mike Donlin,Tom Nawn,Henry Baird,Joe Bricher,Jimmy Bryant,Sergeant Bukowski,C.C. Cruson,Jack Dempster,Keith Fennell,Budd Fine",Passed,United States,None
The Grand Budapest Hotel,,8.1,"Adventure,Comedy,Crime",2014,99,"A writer encounters the owner of an aging high-class hotel, who tells him of his early years serving as a lobby boy in the hotel's glorious years under an exceptional concierge.",Wes Anderson,"Ralph Fiennes,F. Murray Abraham,Mathieu Amalric,Adrien Brody,Willem Dafoe,Jeff Goldblum,Harvey Keitel,Jude Law,Bill Murray,Edward Norton,Saoirse Ronan,Jason Schwartzman,Léa Seydoux,Tilda Swinton,Tom Wilkinson,Owen Wilson,Tony Revolori,Larry Pine",R,"United States,Germany","English,French,German"
Gone Girl,,8.1,"Drama,Mystery,Thriller",2014,149,"With his wife's disappearance having become the focus of an intense media circus, a man sees the spotlight turned on him when it's suspected that he may not be innocent.",David Fincher,"Ben Affleck,Rosamund Pike,Neil Patrick Harris,Tyler Perry,Carrie Coon,Kim Dickens,Patrick Fugit,David Clennon,Lisa Banes,Missi Pyle,Emily Ratajkowski,Casey Wilson,Lola Kirke,Boyd Holbrook,Sela Ward,Lee Norris,Jamie McShane,Leonard Kelly-Young",R,United States,English
Wild Strawberries,Smultronstället,8.1,"Drama,Romance",1957,91,"After living a life marked by coldness, an aging professor is forced to confront the emptiness of his existence.",Ingmar Bergman,"Victor Sjöström,Bibi Andersson,Ingrid Thulin,Gunnar Björnstrand,Jullan Kindahl,Folke Sundquist,Björn Bjelfvenstam,Naima Wifstrand,Gunnel Broström,Gertrud Fridh,Sif Ruud,Gunnar Sjöberg,Max von Sydow,Åke Fridell,Yngve Nordwall,Per Sjöstrand,Gio Petré,Gunnel Lindblom",Not Rated,Sweden,"Swedish,Latin"
Ben-Hur,,8.1,"Adventure,Drama",1959,212,"After a Jewish prince is betrayed and sent into slavery by a Roman friend in 1st-century Jerusalem, he regains his freedom and comes back for revenge.",William Wyler,"Charlton Heston,Jack Hawkins,Stephen Boyd,Haya Harareet,Hugh Griffith,Martha Scott,Cathy O'Donnell,Sam Jaffe,Finlay Currie,Frank Thring,Terence Longdon,George Relph,André Morell,Nello Appodia,Fortunato Arena,Bruno Ariè,Les Ballets Africains,Emma Baron",G,United States,English
The Third Man,,8.1,"Film-Noir,Mystery,Thriller",1949,93,"Pulp novelist Holly Martins travels to shadowy, postwar Vienna, only to find himself investigating the mysterious death of an old friend, Harry Lime.",Carol Reed,"Orson Welles,Joseph Cotten,Alida Valli,Trevor Howard,Paul Hörbiger,Ernst Deutsch,Erich Ponto,Siegfried Breuer,Hedwig Bleibtreu,Bernard Lee,Wilfrid Hyde-White,Nelly Arno,Jack Arrow,Harold Ayer,Harry Belcher,Leo Bieber,Paul Birch,Martin Boddey",Approved,United Kingdom,"English,German,Russian,French"
Harry Potter and the Deathly Hallows: Part 2,Harry Potter and the Deathly Hallows - Part 2,8.1,"Adventure,Family,Fantasy",2011,130,"Harry, Ron, and Hermione search for Voldemort's remaining Horcruxes in their effort to destroy the Dark Lord as the final battle rages on at Hogwarts.",David Yates,"Daniel Radcliffe,Emma Watson,Rupert Grint,Michael Gambon,Ralph Fiennes,Alan Rickman,Evanna Lynch,Domhnall Gleeson,Clémence Poésy,Warwick Davis,John Hurt,Helena Bonham Carter,Graham Duff,Anthony Allgood,Rusty Goffe,Jon Key,Kelly Macdonald,Jason Isaacs",PG-13,"United Kingdom,United States","English,Latin"
Children of Heaven,Bacheha-Ye aseman,8.2,"Drama,Family,Sport",1997,89,"After a boy loses his sister's pair of shoes, he goes on a series of adventures in order to find them. When he can't, he tries a new way to ""win"" a new pair.",Majid Majidi,"Mohammad Amir Naji,Amir Farrokh Hashemian,Bahare Seddiqi,Nafise Jafar-Mohammadi,Fereshte Sarabandi,Kamal Mirkarimi,Behzad Rafi,Dariush Mokhtari,Mohammad-Hasan Hosseinian,Masume Dair,Kambiz Peykarnegar,Hasan Roohparvari,Abbas-Ali Roomandi,Jafar Seyfollahi,Qolamreza Maleki,Zahra Mirzai,Sara Zamani,Mohammad Haj-Hosseini",PG,Iran,Persian
On the Waterfront,,8.1,"Crime,Drama,Thriller",1954,108,"An ex-prize fighter turned New Jersey longshoreman struggles to stand up to his corrupt union bosses, including his older brother, as he starts to connect with the grieving sister of one of the syndicate's victims.",Elia Kazan,"Marlon Brando,Karl Malden,Lee J. Cobb,Rod Steiger,Pat Henning,Leif Erickson,James Westerfield,Tony Galento,Tami Mauriello,John F. Hamilton,John Heldabrand,Rudy Bond,Don Blackman,Arthur Keegan,Abe Simon,Eva Marie Saint,Martin Balsam,Dan Bergin",Approved,United States,English
12 Years a Slave,,8.1,"Biography,Drama,History",2013,134,"In the antebellum United States, Solomon Northup, a free black man from upstate New York, is abducted and sold into slavery.",Steve McQueen,"Chiwetel Ejiofor,Michael Kenneth Williams,Michael Fassbender,Brad Pitt,Dwight Henry,Dickie Gravois,Bryan Batt,Ashley Dyke,Kelsey Scott,Quvenzhané Wallis,Cameron Zeigler,Tony Bentley,Scoot McNairy,Taran Killam,Christopher Berry,Bill Camp,Mister Mackey Jr.,Chris Chalk",R,"United States,United Kingdom",English
The Gold Rush,,8.2,"Adventure,Comedy,Drama",1925,95,"A prospector goes to the Klondike during the 1890s gold rush in hopes of making his fortune, and is smitten with a girl he sees in a dance hall.",Charles Chaplin,"Charles Chaplin,Mack Swain,Tom Murray,Henry Bergman,Malcolm Waite,Georgia Hale,Jack Adams,Frank Aderias,Leona Aderias,Lillian Adrian,Sam Allen,Claude Anderson,Harry Arras,Albert Austin,Marta Belfort,William Bell,Francis Bernhardt,F.J. Beuaregard",Passed,United States,"English,None"
Before Sunrise,,8.1,"Drama,Romance",1995,101,"A young man and woman meet on a train in Europe, and wind up spending one evening together in Vienna. Unfortunately, both know that this will probably be their only night together.",Richard Linklater,"Ethan Hawke,Julie Delpy,Andrea Eckert,Hanno Pöschl,Karl Bruckschwaiger,Tex Rubinowitz,Erni Mangold,Dominik Castell,Haymon Maria Buttinger,Harald Waiglein,Bilge Jeschim,Kurti,Hans Weingartner,Liese Lyon,Peter Ily Huemer,Otto Reiter,Hubert Fabian Kulterer,Branko Andric",R,"United States,Austria","English,German,French"
My Neighbor Totoro,Tonari no Totoro,8.1,"Animation,Comedy,Family",1988,86,"When two girls move to the country to be near their ailing mother, they have adventures with the wondrous forest spirits who live nearby.",Hayao Miyazaki,"Hitoshi Takagi,Noriko Hidaka,Chika Sakamoto,Shigesato Itoi,Sumi Shimamoto,Tanie Kitabayashi,Hiroko Maruyama,Machiko Washio,Reiko Suzuki,Masashi Hirose,Toshiyuki Amagasa,Shigeru Chiba,Naoki Tatsuta,Tarako,Tomohiro Nishimura,Mitsuko Ishida,Chie Kôjiro,Daiki Nakamura",G,Japan,Japanese
Prisoners,,8.1,"Crime,Drama,Mystery",2013,153,"When Keller Dover's daughter and her friend go missing, he takes matters into his own hands as the police pursue multiple leads and the pressure mounts.",Denis Villeneuve,"Hugh Jackman,Jake Gyllenhaal,Viola Davis,Melissa Leo,Maria Bello,Terrence Howard,Paul Dano,Dylan Minnette,Zoë Soul,Erin Gerasimovich,Kyla-Drew,Wayne Duvall,Len Cariou,David Dastmalchian,Brad James,Anthony Reynolds,Robert C. Treveiler,Sandra Ellis Lafferty",R,United States,English
Catch Me If You Can,,8.1,"Biography,Crime,Drama",2002,141,"Barely 21 yet, Frank is a skilled forger who has passed as a doctor, lawyer and pilot. FBI agent Carl becomes obsessed with tracking down the con man, who only revels in the pursuit.",Steven Spielberg,"Leonardo DiCaprio,Tom Hanks,Christopher Walken,Martin Sheen,Nathalie Baye,Amy Adams,James Brolin,Brian Howe,Frank John Hughes,Steve Eastin,Chris Ellis,John Finn,Jennifer Garner,Nancy Lenehan,Ellen Pompeo,Elizabeth Banks,Guy Thauvette,Candice Azzara",PG-13,"United States,Canada","English,French"
Million Dollar Baby,,8.1,"Drama,Sport",2004,132,A determined woman works with a hardened boxing trainer to become a professional.,Clint Eastwood,"Hilary Swank,Clint Eastwood,Morgan Freeman,Jay Baruchel,Mike Colter,Lucia Rijker,Brían F. O'Byrne,Anthony Mackie,Margo Martindale,Riki Lindhome,Michael Peña,Benito Martinez,Bruce MacVittie,David Powledge,Joe D'Angerio,Marcus Chait,Tom McCleister,Erica Grant",PG-13,United States,"English,Irish Gaelic"
Gran Torino,,8.1,Drama,2008,116,"Disgruntled Korean War veteran Walt Kowalski sets out to reform his neighbor, Thao Lor, a Hmong teenager who tried to steal Kowalski's prized possession: a 1972 Gran Torino.",Clint Eastwood,"Clint Eastwood,Bee Vang,Christopher Carley,Ahney Her,Brian Haley,Geraldine Hughes,Dreama Walker,Brian Howe,John Carroll Lynch,William Hill,Brooke Chia Thao,Chee Thao,Choua Kue,Scott Eastwood,Xia Soua Chang,Sonny Vue,Doua Moua,Greg Trzaskoma",R,"Germany,United States","English,Hmong"
Fargo,,8.1,"Crime,Thriller",1996,98,Minnesota car salesman Jerry Lundegaard's inept crime falls apart due to his and his henchmen's bungling and the persistent police work of the quite pregnant Marge Gunderson.,"Joel Coen,Ethan Coen","William H. Macy,Frances McDormand,Steve Buscemi,Peter Stormare,Kristin Rudrüd,Harve Presnell,Tony Denman,Gary Houston,Sally Wingert,Kurt Schweickhardt,Larissa Kokernot,Melissa Peterman,Steve Reevis,Warren Keith,Steve Edelman,Sharon Anderson,Larry Brandenburg,James Gaulke",R,"United States,United Kingdom",English
Blade Runner,,8.1,"Action,Drama,Sci-Fi",1982,117,A blade runner must pursue and terminate four replicants who stole a ship in space and have returned to Earth to find their creator.,Ridley Scott,"Harrison Ford,Rutger Hauer,Sean Young,Edward James Olmos,M. Emmet Walsh,Daryl Hannah,William Sanderson,Brion James,Joe Turkel,Joanna Cassidy,James Hong,Morgan Paull,Kevin Thompson,John Edward Allen,Hy Pyke,Kimiko Hiroshige,Bob Okazaki,Carolyn DeMirjian",R,United States,"English,German,Cantonese,Japanese,Hungarian,Arabic,Korean"
